User,Handle,PostDate,TweetText,ReplyCount,RetweetCount,LikeCount
Lending Alpha,LendingAlpha,2018-01-14,american trust investment advisors lowered weyerhaeuser co wy stake by 595306 as share,0.0,0.0,0.0
Alessandro Bellese,ale_bellese,2017-12-06,and who knew that 17thplace weyerhaeuser co wy would score in the top 1 of companies in terms of innovation,0.0,0.0,0.0
SeqComplete,SeqComplete,2018-01-14,coldstream capital management has boosted weyerhaeuser co wy holding aethlon medical,0.0,0.0,0.0
Community Financial,CFinancialNews,2018-02-27,033 eps expected for weyerhaeuser co wy this quarter,0.0,0.0,0.0
Watchlist News,WatchlistN,2018-01-31,14967 shares in weyerhaeuser co wy purchased by pineno levin ford asset management inc,0.0,0.0,0.0
Community Financial,CFinancialNews,2018-02-28,179 billion in sales expected for weyerhaeuser co wy this quarter,0.0,0.0,0.0
StockTrot,stocktrot,2017-12-09,3244695 largest selloff of weyerhaeuser co shares for hagen russell s in 8 months,0.0,0.0,0.0
Ticker Report,TickerReport,2018-02-16,32615 shares in weyerhaeuser co wy purchased by orleans capital management corp la,0.0,0.0,0.0
Watchlist News,WatchlistN,2018-01-20,7739 shares in weyerhaeuser co wy acquired by capital investment advisors llc,0.0,0.0,0.0
WKRB News,WKRBNews,2018-01-31,83010 shares in weyerhaeuser co wy purchased by twin capital management inc,0.0,0.0,0.0
Ticker Report,TickerReport,2018-02-23,allen capital group llc acquires new position in weyerhaeuser co wy,0.0,0.0,0.0
Community Financial,CFinancialNews,2018-03-13,alliancebernstein lp has 5493 million position in weyerhaeuser co wy,0.0,0.0,0.0
Transcript Daily,TranscriptDaily,2018-03-03,amalgamated bank buys 8375 shares of weyerhaeuser co wy,0.0,0.0,0.0
Community Financial,CFinancialNews,2018-03-03,amalgamated bank has 332 million position in weyerhaeuser co wy,0.0,0.0,0.0
Dakota Financial,dakotafinancial,2018-02-14,american research management co raises position in weyerhaeuser co wy,0.0,0.0,0.0
James Sikes,wosaikeneriki,2018-02-03,american trust investment advisors has lowered its weyerhaeuser co wy stake as stock declined,0.0,0.0,0.0
Watchlist News,WatchlistN,2018-02-05,american trust investment advisors llc has 136 million holdings in weyerhaeuser co wy,0.0,0.0,0.0
Dakota Financial,dakotafinancial,2018-02-23,amica mutual insurance co reduces stake in weyerhaeuser co wy,0.0,0.0,0.0
The Markets Daily,TheMarketsDaily,2018-02-01,analysts expect weyerhaeuser co wy will post earnings of 035 per share,0.0,0.0,0.0
James Sikes,wosaikeneriki,2018-02-12,as schlumberger ltd slb share price declined glynn capital management increased its position grandfield dodd has lifted its weyerhaeuser co wy positi,0.0,0.0,0.0
James Sikes,wosaikeneriki,2017-11-13,as weyerhaeuser co wy market valuation declined blair william company boosted stake by 108 million,0.0,0.0,0.0
James Sikes,wosaikeneriki,2017-11-08,as weyerhaeuser co wy share price declined sterling investment management lowered stake by 102 million,0.0,0.0,0.0
James Sikes,wosaikeneriki,2017-11-05,as weyerhaeuser co wy stock declined hamlin capital management lowered its position by 131 million,0.0,0.0,0.0
James Sikes,wosaikeneriki,2017-11-23,as weyerhaeuser co wy stock declined holder caprock group trimmed by 359238 its stake,0.0,0.0,0.0
The Markets Daily,TheMarketsDaily,2017-12-09,asset management one co ltd buys 7084 shares of weyerhaeuser company wy,0.0,0.0,0.0
MarketBeat,MarketBeatCom,2017-12-25,atlantic trust group llc purchases 27233 shares of weyerhaeuser co wy,0.0,0.0,0.0
Noodles Bee,Noodles398Bee14,2017-11-15,azimuth capital management has upped weyerhaeuser co wy stake by 326337 noodles,0.0,0.0,0.0
Dakota Financial,dakotafinancial,2018-03-10,baker avenue asset management lp raises position in weyerhaeuser co wy,0.0,0.0,0.0
WKRB News,WKRBNews,2018-01-30,baker ellis asset management llc trims position in weyerhaeuser co wy,0.0,0.0,0.0
James Sikes,wosaikeneriki,2018-02-17,banco macro sa bma share price rose while tt international has trimmed position by 338 million weyerhaeuser co wy stake increased by zwj investment counsel i,0.0,0.0,0.0
WKRB News,WKRBNews,2018-01-24,bank of montreal can has 2974 million stake in weyerhaeuser co wy,0.0,0.0,0.0
Watchlist News,WatchlistN,2018-02-14,barings llc raises stake in weyerhaeuser co wy,0.0,0.0,0.0
Ticker Report,TickerReport,2018-02-09,bedel financial consulting inc buys shares of 11902 weyerhaeuser co wy,0.0,0.0,0.0
Dakota Financial,dakotafinancial,2018-02-08,bedell frazier investment counseling llc purchases 1886 shares of weyerhaeuser co wy,0.0,0.0,0.0
US Banking News,AmericanBanking,2018-03-04,bluestein r h co sells 70448 shares of weyerhaeuser co wy,0.0,0.0,0.0
The Lincolnian,ThisLincolnian,2018-01-29,bollard group llc has 1134 million position in weyerhaeuser co wy,0.0,0.0,0.0
James Sikes,wosaikeneriki,2017-12-31,boston family office has cut weyerhaeuser co wy position by 886278 as stock value declined,0.0,0.0,0.0
StocksPredictor,StocksPredictr,2018-03-05,bradley foster sargent inc ct reduces stake in weyerhaeuser co nysewy wy 1,0.0,1.0,0.0
Vladimir de BERTREN,BeLikeADiamond,2017-11-13,brant point investment management trimmed by 231 million its weyerhaeuser co wy stake,0.0,0.0,0.0
Ticker Report,TickerReport,2018-02-28,brokerages expect weyerhaeuser co wy will post quarterly sales of 179 billion,0.0,0.0,0.0
Storm Investor,storminvestor,2018-02-27,brokerages set weyerhaeuser co wy pt at 3783,0.0,0.0,0.0
"#hiswai",hiswai,2018-01-18,brookfield asset management has trimmed by 727 million its weyerhaeuser co wy stake cm,0.0,0.0,0.0
Watchlist News,WatchlistN,2018-01-31,btr capital management inc grows position in weyerhaeuser co wy,0.0,0.0,0.0
Ticker Report,TickerReport,2018-02-28,buckingham asset management llc increases holdings in weyerhaeuser co wy,0.0,0.0,0.0
The Markets Daily,TheMarketsDaily,2018-02-09,cadence capital management llc has 204 million stake in weyerhaeuser co wy,0.0,0.0,0.0
The Markets Daily,TheMarketsDaily,2018-02-13,california public employees retirement system has 6818 million holdings in weyerhaeuser co wy,0.0,0.0,0.0
The Markets Daily,TheMarketsDaily,2018-01-23,central trust co has 505 million holdings in weyerhaeuser co wy,0.0,0.0,0.0
Watchlist News,WatchlistN,2018-01-25,chevy chase trust holdings inc boosts holdings in weyerhaeuser co wy,0.0,0.0,0.0
Storm Investor,storminvestor,2018-02-07,cibc world markets inc acquires shares of 2466 weyerhaeuser co wy,0.0,0.0,0.0
The Lincolnian,ThisLincolnian,2018-02-07,cibc world markets inc buys new position in weyerhaeuser co wy,0.0,0.0,0.0
MarketBeat,MarketBeatCom,2018-01-09,confluence investment management llc acquires 2518 shares of weyerhaeuser co wy,0.0,0.0,0.0
The Markets Daily,TheMarketsDaily,2018-01-09,confluence investment management llc buys 2518 shares of weyerhaeuser co wy,0.0,0.0,0.0
Dakota Financial,dakotafinancial,2018-01-25,cornerstone advisors inc grows stake in weyerhaeuser co wy,0.0,0.0,0.0
The Lincolnian,ThisLincolnian,2018-01-24,creative planning has 224 million stake in weyerhaeuser co wy,0.0,0.0,0.0
Wayne Lopez,wayne_lopez,2018-03-09,croftleominster has decreased its weyerhaeuser co wy holding xpo logistics has 142,0.0,0.0,0.0
Dakota Financial,dakotafinancial,2018-02-12,crossmark global holdings inc buys 3690 shares of weyerhaeuser co wy,0.0,0.0,0.0
Storm Investor,storminvestor,2017-12-23,cubist systematic strategies llc acquires 11779 shares of weyerhaeuser co wy,0.0,0.0,0.0
James Sikes,wosaikeneriki,2018-02-17,cwm has lifted its acacia resh actg stake weyerhaeuser co wy holding held by coldstream capital management i,0.0,0.0,0.0
The Markets Daily,TheMarketsDaily,2018-02-15,da davidson co boosts holdings in weyerhaeuser co wy,0.0,0.0,0.0
Teletechwire,teletechwire,2018-01-13,determine inc dtrm forms 199 double bottom weyerhaeuser co wy sentiment is 11,0.0,0.0,0.0
James Sikes,wosaikeneriki,2017-11-09,eagle ridge investment management has boosted weyerhaeuser co wy holding by 435369 as share value declined,0.0,0.0,0.0
Transcript Daily,TranscriptDaily,2018-02-11,edgemoor investment advisors inc has 410 million holdings in weyerhaeuser co wy,0.0,0.0,0.0
The Lincolnian,ThisLincolnian,2018-02-02,family legacy inc raises stake in weyerhaeuser co wy,0.0,0.0,0.0
Community Financial,CFinancialNews,2018-03-03,farr miller washington llc dc boosts stake in weyerhaeuser co wy,0.0,0.0,0.0
The Lincolnian,ThisLincolnian,2018-03-02,farr miller washington llc dc has 210 million position in weyerhaeuser co wy,0.0,0.0,0.0
Watchlist News,WatchlistN,2017-11-10,fiduciary trust co has 138 million stake in weyerhaeuser company wy,0.0,0.0,0.0
Dakota Financial,dakotafinancial,2018-02-25,first allied advisory services inc buys 2596 shares of weyerhaeuser co wy,0.0,0.0,0.0
James Sikes,wosaikeneriki,2018-02-26,first eagle investment management llc has lifted its holding in weyerhaeuser co wy as valuation declin,0.0,0.0,0.0
James Sikes,wosaikeneriki,2018-02-26,first eagle investment management llc has lifted its weyerhaeuser co wy position by 3236 milli,0.0,0.0,0.0
The Markets Daily,TheMarketsDaily,2017-11-15,first national trust co has 39800 stake in weyerhaeuser company wy,0.0,0.0,0.0
Dakota Financial,dakotafinancial,2018-03-13,first trust advisors lp has 350 million stake in weyerhaeuser co wy,0.0,0.0,0.0
Ticker Report,TickerReport,2018-03-06,formidable asset management llc invests 57100 in weyerhaeuser co wy,0.0,0.0,0.0
Storm Investor,storminvestor,2018-02-14,forsta ap fonden has 776 million position in weyerhaeuser co wy,0.0,0.0,0.0
Ticker Report,TickerReport,2018-01-23,forte capital llc adv invests 30800 in weyerhaeuser co wy stock,0.0,0.0,0.0
Storm Investor,storminvestor,2018-02-09,gabelli funds llc decreases position in weyerhaeuser co wy,0.0,0.0,0.0
Watchlist News,WatchlistN,2018-01-22,gateway investment advisers llc cuts stake in weyerhaeuser co wy,0.0,0.0,0.0
The Lincolnian,ThisLincolnian,2018-03-05,geode capital management llc has 32908 million position in weyerhaeuser co wy,0.0,0.0,0.0
Top Examiner,thetopexaminer,2018-01-24,global wood based panel market competitive dynamics 2018 kronospan ltd shanghai jechen group co ltd interfor corporation weyerhaeuser company,0.0,0.0,0.0
Albert Dodd,AlbertDodd,2017-11-06,grandfield dodd llc buys weyerhaeuser co us bancorp mt bank corp,0.0,0.0,0.0
Investors,businessinvesto,2017-11-03,grandfield dodd llc buys weyerhaeuser co us bancorp mt bank corp sells emerson,0.0,0.0,0.0
The Lincolnian,ThisLincolnian,2018-02-02,granite investment partners llc sells 2750 shares of weyerhaeuser co wy,0.0,0.0,0.0
James Sikes,wosaikeneriki,2017-11-09,gruss capital management lp has boosted its weyerhaeuser co put wy position by 3003 million as market v,0.0,0.0,0.0
Storm Investor,storminvestor,2018-02-01,hamlin capital management llc has 8167 million position in weyerhaeuser co wy,0.0,0.0,0.0
James Sikes,wosaikeneriki,2017-12-19,hamlin capital management trimmed position in weyerhaeuser co wy as valuation declined,0.0,0.0,0.0
Storm Investor,storminvestor,2018-02-16,hc financial advisors inc takes position in weyerhaeuser co wy,0.0,0.0,0.0
NW Carriage Museum,NWCMuseum,2018-02-11,hub from our kimball towncoach cp kimball co chicago illinois once owned by cf denkman brother in law to frederick weyerhaeuser come in for the full history 1 1,0.0,1.0,1.0
The Markets Daily,TheMarketsDaily,2018-02-09,huntington national bank has 122 million stake in weyerhaeuser co wy,0.0,0.0,0.0
Dakota Financial,dakotafinancial,2018-01-29,ifp advisors inc sells 6482 shares of weyerhaeuser co wy,0.0,0.0,0.0
The Markets Daily,TheMarketsDaily,2018-02-19,kbc group nv has 467 million position in weyerhaeuser co wy,0.0,0.0,0.0
The Lincolnian,ThisLincolnian,2018-02-22,keybank national association oh cuts position in weyerhaeuser co wy,0.0,0.0,0.0
The Lincolnian,ThisLincolnian,2018-01-30,klingenstein fields co llc reduces holdings in weyerhaeuser co wy,0.0,0.0,0.0
Ticker Report,TickerReport,2017-11-04,korea investment corp sells 21900 shares of weyerhaeuser co wy,0.0,0.0,0.0
globalaltinvest,globalaltinvest,2018-01-21,laffer investments trimmed its weyerhaeuser co wy holding by 13288 million vf vfc,0.0,0.0,0.0
TheExtraIncome,TheExtraIncome,2017-10-31,largest trades of the month co,0.0,0.0,0.0
The Lincolnian,ThisLincolnian,2018-01-17,lawson kroeker investment management inc ne has 864 million holdings in weyerhaeuser co wy,0.0,0.0,0.0
Storm Investor,storminvestor,2018-03-02,liberty mutual group asset management inc sells 2198 shares of weyerhaeuser co wy,0.0,0.0,0.0
Vladimir de BERTREN,BeLikeADiamond,2018-03-04,madison investment holdings has boosted by 56100 its weyerhaeuser co wy stake oz,0.0,0.0,0.0
Storm Investor,storminvestor,2018-01-27,markston international llc has 18900 stake in weyerhaeuser co wy,0.0,0.0,0.0
The Lincolnian,ThisLincolnian,2018-01-29,meag munich ergo kapitalanlagegesellschaft mbh purchases 36059 shares of weyerhaeuser co wy,0.0,0.0,0.0
The Lincolnian,ThisLincolnian,2018-03-07,merit financial group llc buys new holdings in weyerhaeuser co wy,0.0,0.0,0.0
Dakota Financial,dakotafinancial,2018-01-26,miller howard investments inc ny has 9095 million stake in weyerhaeuser co wy,0.0,0.0,0.0
WKRB News,WKRBNews,2018-02-10,mitsubishi ufj kokusai asset management co ltd increases holdings in weyerhaeuser co wy,0.0,0.0,0.0
James Sikes,wosaikeneriki,2018-03-12,moors cabot lifted att t stake by 165 million as weyerhaeuser co wy stock price declined first eagle investment management has lifted stake by 3236 milli,0.0,0.0,0.0
Budd-Falen Law,Buddfalenlaw,2018-01-26,more and more lands are being used as critical habitat for endangered species under the after designation most uses of thatland arent allowed the agreed to hear weyerhaeuser co v to see if large designations are 1,0.0,0.0,1.0
Dakota Financial,dakotafinancial,2018-02-16,mufg americas holdings corp acquires 5763 shares of weyerhaeuser co wy,0.0,0.0,0.0
Dakota Financial,dakotafinancial,2018-01-19,national pension service has 2760 million position in weyerhaeuser co wy,0.0,0.0,0.0
Connections Magazine,ConnectionsMS,2017-11-03,neshoba engineering students tour weyerhaeuser co the neshoba democrat philadelphia mississippi,0.0,0.0,0.0
Storm Investor,storminvestor,2018-01-14,nisa investment advisors llc acquires 153170 shares of weyerhaeuser co wy,0.0,0.0,0.0
The Markets Daily,TheMarketsDaily,2018-02-13,nuwave investment management llc invests 32600 in weyerhaeuser co wy stock,0.0,0.0,0.0
The Lincolnian,ThisLincolnian,2018-01-21,oakbrook investments llc has 104 million holdings in weyerhaeuser co wy,0.0,0.0,0.0
Kevin Daley,KevinDaleyDC,2018-01-22,one new grant in weyerhaeuser co v fish and wildlife a habitatdesignation case many conservatives urged to hear 1,1.0,0.0,0.0
James Sikes,wosaikeneriki,2018-02-20,ontario teachers pension plan board lowered weyerhaeuser co wy holding by 800258 as share price declined rwwm position in international business machs ibm has upped by 7057,0.0,0.0,0.0
The Markets Daily,TheMarketsDaily,2018-02-10,oppenheimer co inc has 1325 million stake in weyerhaeuser co wy,0.0,0.0,0.0
ShippingInsurance,ShippingInsured,2018-02-16,paloma partners management company lifted weyerhaeuser co put wy holding by 163,0.0,0.0,0.0
Dakota Financial,dakotafinancial,2018-02-02,parametrica management ltd acquires shares of 14214 weyerhaeuser co wy,0.0,0.0,0.0
WKRB News,WKRBNews,2018-02-05,patten group inc lowers stake in weyerhaeuser co wy,0.0,0.0,0.0
The Lincolnian,ThisLincolnian,2018-02-13,pegasus partners ltd decreases holdings in weyerhaeuser co wy,0.0,0.0,0.0
The Lincolnian,ThisLincolnian,2018-01-31,pineno levin ford asset management inc purchases new stake in weyerhaeuser co wy,0.0,0.0,0.0
James Sikes,wosaikeneriki,2018-01-30,pittenger anderson cut stake in weyerhaeuser co wy by 204 million as valuation declined,0.0,0.0,0.0
The Market is Open,themarketisopen,2018-03-12,pmc weyerhaeuser co call wy holder citigroup has cut its position as shares,0.0,0.0,0.0
Ticker Report,TickerReport,2018-02-21,private advisor group llc lowers holdings in weyerhaeuser co wy,0.0,0.0,0.0
The Lincolnian,ThisLincolnian,2018-02-21,private advisor group llc trims holdings in weyerhaeuser co wy,0.0,0.0,0.0
HCI Railings,HCIRailings,2018-02-15,public employees retirement association of colorado boosts position in weyerhaeuser co,0.0,0.0,0.0
Daily Political,dailypoliticaln,2018-02-10,public employees retirement association of colorado boosts position in weyerhaeuser co wy,0.0,0.0,0.0
Ohio Home Buyers,webuyohiohouses,2018-01-11,public employees retirement system of ohio sells 79837 shares of weyerhaeuser co wy,0.0,0.0,0.0
Watchlist News,WatchlistN,2017-11-18,putnam fl investment management co purchases shares of 16970 weyerhaeuser company wy,0.0,0.0,0.0
Storm Investor,storminvestor,2018-03-10,quantitative investment management llc takes position in weyerhaeuser co wy,0.0,0.0,0.0
Watchlist News,WatchlistN,2018-02-26,raab moskowitz asset management llc sells 6440 shares of weyerhaeuser co wy,0.0,0.0,0.0
Storm Investor,storminvestor,2018-02-16,retirement systems of alabama increases stake in weyerhaeuser co wy,0.0,0.0,0.0
Storm Investor,storminvestor,2018-02-04,robeco institutional asset management bv boosts holdings in weyerhaeuser co wy,0.0,0.0,0.0
US Banking News,AmericanBanking,2018-02-27,sasco capital inc ct sells 554036 shares of weyerhaeuser co wy,0.0,0.0,0.0
James Sikes,wosaikeneriki,2018-02-23,sasco capital inc decreased weyerhaeuser co nysewy stake by 1939 milli,0.0,0.0,0.0
The Lincolnian,ThisLincolnian,2018-01-11,sawyer company inc takes 53500 position in weyerhaeuser co wy,0.0,0.0,0.0
Dakota Financial,dakotafinancial,2018-01-11,sawyer company inc takes position in weyerhaeuser co wy,0.0,0.0,0.0
Ticker Report,TickerReport,2018-02-02,schwab charles investment management inc has 9187 million holdings in weyerhaeuser co wy,0.0,0.0,0.0
Watchlist News,WatchlistN,2018-03-12,scotia capital inc acquires 1762 shares of weyerhaeuser co wy,0.0,0.0,0.0
Daniel Leddy,LegalHotShots,2018-01-22,scotus has granted certiorari in weyerhaeuser co v us fish and wildlife service an environmental law case that involves an endangered gopher frog that can only exist in a very specific habitat,0.0,0.0,0.0
Watchlist News,WatchlistN,2018-02-07,seacrest wealth management llc takes position in weyerhaeuser co wy,0.0,0.0,0.0
Dakota Financial,dakotafinancial,2018-02-13,sentry investment management llc has 206 million position in weyerhaeuser co wy,0.0,0.0,0.0
The Markets Daily,TheMarketsDaily,2018-01-17,sicart associates llc acquires 1500 shares of weyerhaeuser co wy,0.0,0.0,0.0
The Lincolnian,ThisLincolnian,2018-01-17,skylands capital llc trims position in weyerhaeuser co wy,0.0,0.0,0.0
The Lincolnian,ThisLincolnian,2018-02-20,smith moore co takes position in weyerhaeuser co wy,0.0,0.0,0.0
Ticker Report,TickerReport,2018-01-16,solaris asset management llc purchases 2495 shares of weyerhaeuser co wy,0.0,0.0,0.0
US Banking News,AmericanBanking,2018-03-03,standard life aberdeen plc has 658 million position in weyerhaeuser co wy,0.0,0.0,0.0
Transcript Daily,TranscriptDaily,2018-02-20,stanley laman group ltd purchases 2636 shares of weyerhaeuser co wy,0.0,0.0,0.0
Storm Investor,storminvestor,2018-02-26,state of tennessee treasury department has 1125 million position in weyerhaeuser co wy,0.0,0.0,0.0
US Banking News,AmericanBanking,2018-02-26,state of tennessee treasury department has 1125 million stake in weyerhaeuser co wy,0.0,0.0,0.0
WKRB News,WKRBNews,2018-02-19,state of wisconsin investment board purchases 19853 shares of weyerhaeuser co wy,0.0,0.0,0.0
Transcript Daily,TranscriptDaily,2018-01-11,stock yards bank trust co reduces position in weyerhaeuser co wy,0.0,0.0,0.0
The Lincolnian,ThisLincolnian,2018-01-24,strs ohio lowers position in weyerhaeuser co wy,0.0,0.0,0.0
Ohio Home Buyers,webuyohiohouses,2018-02-16,strs ohio lowers stake in weyerhaeuser co wy,0.0,0.0,0.0
Ohio Home Buyers,webuyohiohouses,2018-01-31,strs ohio reduces stake in weyerhaeuser co wy,0.0,0.0,0.0
Storm Investor,storminvestor,2018-02-04,sumitomo life insurance co sells 1838 shares of weyerhaeuser co wy,0.0,0.0,0.0
Watchlist News,WatchlistN,2018-03-03,suntrust banks inc buys 14839 shares of weyerhaeuser co wy,0.0,0.0,0.0
JVC Appraisals & Home Inspections,JVC_appr_inspct,2018-02-02,supreme court hops into property rights case the supreme court will hear a case in which weyerhaeuser co is challenging the state of louisianas power to potentially erase 34 million in land value by designating 1500 privately owned acres of fore,0.0,0.0,0.0
Transcript Daily,TranscriptDaily,2018-02-21,tcw group inc grows holdings in weyerhaeuser co wy,0.0,0.0,0.0
Storm Investor,storminvestor,2018-03-11,teachers insurance annuity association of america cuts holdings in weyerhaeuser co wy,0.0,0.0,0.0
Community Financial,CFinancialNews,2018-03-11,teachers insurance annuity association of america has 702 million position in weyerhaeuser co wy,0.0,0.0,0.0
Dakota Financial,dakotafinancial,2018-01-26,texas permanent school fund reduces stake in weyerhaeuser co wy,0.0,0.0,0.0
Date Elementary,FUSD_Date,2017-12-15,thank you weyerhaeuser co and quadgraphics for making our date students so happy celebrating with them christmas in the classroom 1,0.0,0.0,1.0
Chris “Subscribe to Law Dork!” Geidner,chrisgeidner,2018-01-22,the court announces one new grant this morning weyerhaeuser co v fish and wildlife 1771 1 6 7,1.0,6.0,7.0
Dakota Financial,dakotafinancial,2018-02-22,the manufacturers life insurance company sells 99768 shares of weyerhaeuser co wy,0.0,0.0,0.0
Luana Martins Castro,martinscastro1k,2017-11-08,the marble harbor investment counsel llc reached 50600 position of weyerhaeuser co wy,0.0,0.0,0.0
This Online,ThisOnline_Co,2018-01-09,this mornings technical outlook on lumber wood production stocks universal forest products rayonier weyerhaeuser and boise cascade,0.0,0.0,0.0
The Lincolnian,ThisLincolnian,2018-03-11,thrivent financial for lutherans has 2166 million stake in weyerhaeuser co wy,0.0,0.0,0.0
Watchlist News,WatchlistN,2018-03-06,tocqueville asset management lp sells 112731 shares of weyerhaeuser co wy,0.0,0.0,0.0
Watchlist News,WatchlistN,2018-02-17,toronto dominion bank increases position in weyerhaeuser co wy,0.0,0.0,0.0
Transcript Daily,TranscriptDaily,2018-03-07,truewealth llc takes 18500 position in weyerhaeuser co wy,0.0,0.0,0.0
The Lincolnian,ThisLincolnian,2018-02-18,uncommon cents investing llc acquires shares of 94309 weyerhaeuser co wy,0.0,0.0,0.0
Rocketnews,Rocketnews1,2018-01-22,update 1us top court takes up property rights case involving endangered frog washington jan 22 reuters the us supreme court on monday agreed hear a bid by timber company weyerhaeuser co seeking to,0.0,0.0,0.0
James Sikes,wosaikeneriki,2018-03-10,van hulzen asset management boosted stake in chevron cvx by 820872 weyerhaeuser co wy position increased by amf pensionsforsakring,0.0,0.0,0.0
Community Financial,CFinancialNews,2018-03-02,venturi wealth management llc acquires 3887 shares of weyerhaeuser co wy,0.0,0.0,0.0
Dakota Financial,dakotafinancial,2018-01-27,vicus capital boosts stake in weyerhaeuser co wy,0.0,0.0,0.0
Watchlist News,WatchlistN,2018-01-31,vigilant capital management llc increases stake in weyerhaeuser co wy,0.0,0.0,0.0
everett jackson,esqueaky01,2018-01-07,webster bank upped weyerhaeuser co wy position by 719134 coloplast as b dkk 1,0.0,0.0,0.0
The Lincolnian,ThisLincolnian,2018-02-19,wedbush securities inc acquires 2529 shares of weyerhaeuser co wy,0.0,0.0,0.0
Early Retirement,InfoDividend,2018-02-02,weyerhaeuser co 2017 q4 results earnings call slides,0.0,0.0,0.0
Community Financial,CFinancialNews,2018-02-24,weyerhaeuser co announces quarterly dividend of 032 wy,0.0,0.0,0.0
James Sikes,wosaikeneriki,2018-01-15,weyerhaeuser co com wy holder symphony asset management has boosted stake,0.0,0.0,0.0
James Sikes,wosaikeneriki,2018-03-04,weyerhaeuser co dl 125 whc declines 22 on mar,0.0,0.0,0.0
Dividend Growth Info,DivgrowthInfo,2017-11-10,weyerhaeuser co raised its dividend 323 wy fwd yield 353,0.0,0.0,0.0
FirstToMarkets,firsttomarkets,2018-01-24,weyerhaeuser co upgrade by bank of america ranked 47th to buy wy,0.0,0.0,0.0
Watchlist News,WatchlistN,2018-02-24,weyerhaeuser co wy announces 032 quarterly dividend,0.0,0.0,0.0
STOCKS & COMMODITIES,STOCKSandCOMM,2018-01-20,weyerhaeuser co wy bullish cci signal on 011918,0.0,0.0,0.0
The Lincolnian,ThisLincolnian,2018-01-30,weyerhaeuser co wy expected to announce earnings of 035 per share,0.0,0.0,0.0
The Lincolnian,ThisLincolnian,2018-03-06,weyerhaeuser co wy expected to announce quarterly sales of 179 billion,0.0,0.0,0.0
Community Financial,CFinancialNews,2018-01-09,weyerhaeuser co wy expected to announce quarterly sales of 187 billion,0.0,0.0,0.0
US Banking News,AmericanBanking,2018-01-09,weyerhaeuser co wy expected to announce quarterly sales of 187 billion 1,0.0,0.0,1.0
The Lincolnian,ThisLincolnian,2018-03-01,weyerhaeuser co wy expected to post earnings of 033 per share,0.0,0.0,0.0
Investors,businessinvesto,2018-02-17,weyerhaeuser co wy files 10k for the fiscal year ended on december 31 2017,0.0,0.0,0.0
The Markets Daily,TheMarketsDaily,2018-02-24,weyerhaeuser co wy given consensus rating of hold by analysts,0.0,0.0,0.0
Community Financial,CFinancialNews,2018-01-06,weyerhaeuser co wy given consensus recommendation of buy by analysts,0.0,0.0,0.0
US Banking News,AmericanBanking,2018-02-24,weyerhaeuser co wy given consensus recommendation of hold by analysts,0.0,0.0,0.0
James Sikes,wosaikeneriki,2017-12-05,weyerhaeuser co wy holder caprock group decreased its holding as market valuation declined,0.0,0.0,0.0
Ohio Home Buyers,webuyohiohouses,2018-03-07,weyerhaeuser co wy holder first eagle investment management llc boosted position,0.0,0.0,0.0
James Sikes,wosaikeneriki,2018-02-11,weyerhaeuser co wy holder first eagle investment management llc has boosted position by 3236 million as market value declin 1,1.0,0.0,0.0
