User,Handle,PostDate,TweetText,ReplyCount,RetweetCount,LikeCount
Indian Chemical News,chemical_news,2021-12-17,fmc signs corteva to provide growers seed treatment insecticides 1,0.0,0.0,1.0
FMC Corporation,FMCCorp,2018-02-12,fmc spotlight dr rebecca lee crumpler was the first black woman physician in the us she also published book of medical discourses in two parts which is regarded as the first medical text written by an africanamerican author 1 1,0.0,1.0,1.0
FMC Corporation,FMCCorp,2018-02-15,fmc spotlight ernest everett just was an africanamerican biologist and educator who pioneered fertilization research and won the naacps first spingarn medal for outstanding achievement by a black american 1 2,0.0,1.0,2.0
FMC Corporation,FMCCorp,2018-02-22,fmc spotlight ida b wells was a true polymathwhile being a journalist newspaper editor suffragist and sociologist she was also an early leader in the civil rights movement read about numerous accomplishments here 1 1,0.0,1.0,1.0
FMC Corporation,FMCCorp,2018-02-19,fmc spotlight stephen smith an indentured servant earned enough to buy his freedom and eventually established his own lumber and coal business which made him one of the wealthiest african americans in columbia pennsylvania 1 3,0.0,1.0,3.0
FMC Corporation,FMCCorp,2019-03-11,fmc stem award nominee lisa hoffman leads a biology team that discovers optimizes and characterizes novel crop protection products in growth chamber greenhouse and field studies 5,0.0,0.0,5.0
Rutuja Mishra,MishraRutuja,2021-10-11,fmc stock price fmc corp stock quote us nyse marketwatch,0.0,0.0,0.0
UltraAlgo™,ShortAlgoTrades,2021-09-07,fmc stock rating changed to sell fmc corp gtgt ultraalgocom stock trading ideas for stocks etfs forex and futures stock trading ideas to optimize portfolio performance with algorithms leverage the same tools used by high frequency traders to beat the market,0.0,0.0,0.0
Sarah Daily,SarahDaily2,2021-09-05,fmc tech talk tips for cotton defoliation in new mexico and texas really good defoliation tips from dr sam rustom fmc tech services using in your cotton program check it out youtubecom fmc tech talk tips for cotton defoliation there are endless methods and options when it comes to cotton defoliation learn ways to elevate your strategy from fmc technical service manager sam rustom 1 1,1.0,0.0,1.0
Stockflare US Page,StockflareUS,2018-06-01,fmc the forecast dividend for fmc corp has decreased to 072 per share from 085 in the last week,0.0,0.0,0.0
Stockflare US Page,StockflareUS,2018-05-16,fmc the forecast dividend for fmc corp has increased to 085 per share from 072 in the last week,0.0,0.0,0.0
Stockflare US Page,StockflareUS,2019-02-12,fmc the forecast dividend for fmc corp has increased to 16 per share from 068 in the last week,0.0,0.0,0.0
Stockflare US Page,StockflareUS,2020-02-08,fmc the forecast dividend for fmc corp has increased to 192 per share from 161 in the last week,0.0,0.0,0.0
Stockflare US Page,StockflareUS,2018-05-05,fmc the forecast eps for fmc corp has increased to 598 from 567 in the last week,0.0,0.0,0.0
Stockflare US Page,StockflareUS,2020-02-08,fmc the forecast eps for fmc corp has increased to 669 from 587 in the last week,0.0,0.0,0.0
The Market is Open,themarketisopen,2017-12-03,fmc the state of tennessee treasury department boosts stake in fmc corp fmc,0.0,0.0,0.0
Stockflare US Page,StockflareUS,2019-11-05,fmc the target price for fmc corp has increased to 10489 from 9958 in the last week,0.0,0.0,0.0
Stockflare US Page,StockflareUS,2020-02-08,fmc the target price for fmc corp has increased to 11972 from 11061 in the last week,0.0,0.0,0.0
Stockflare US Page,StockflareUS,2017-11-10,fmc the target price for fmc corp has increased to 9805 from 9326 in the last week,0.0,0.0,0.0
Indian Chemical News,chemical_news,2022-07-01,fmc to acquire biological company biophero indianchemicalnewscom fmc to acquire biological company biophero the company expects pheromones and pheromonebased products to contribute approximately us 1 billion in revenue at above companyaverage ebitda margin by 2030,0.0,0.0,0.0
Toppan Merrill,Toppan_Merrill,2018-02-15,fmc to focus on core business with spinoff pesticide maker fmc corp is preparing to spin off its lithium business the latest in a wave of companies looking to slim down their portfolio and focus on core business,0.0,0.0,0.0
FMC Corporation,FMCCorp,2021-03-19,fmc tower in philadelphia was lit up purple all of last week to celebrate international womens day and the achievements of women all around the world 4 16,0.0,4.0,16.0
FMC Corporation,FMCCorp,2019-11-21,fmc tower receives a healthy building certification heres what it means 3 15,0.0,3.0,15.0
FMC Corporation,FMCCorp,2019-06-16,fmc true champions rewards what you accomplish every day provides you with resources to run your business and supports the future of your industry enroll by the 4th of july now 6 14,0.0,6.0,14.0
Agrovision India,agrovisionindia,2022-06-23,fmc unveils new plant health business brand identity read more at agrospectrumindiacom fmc unveils new plant health business brand identity agrospectrum india biologicals by fmc demonstrates fmcs commitment to providing,0.0,0.0,0.0
FMC Corporation,FMCCorp,2018-09-07,fmc values farmers and their perspective get the inside scoop with dr tim durham professor of ag sciences and farmer on the everevolving industry of farming 1 3,0.0,1.0,3.0
FMC Corporation,FMCCorp,2019-11-25,fmc was highly commended for its applications technology innovation during this past awards 3rive 3d technology efficiently covers more ground in less time with fewer refills saving water fuel labor and time 3 12,0.0,3.0,12.0
FMC Corporation,FMCCorp,2019-11-27,fmc was highly commended for its doctor soil stewardship program during this past awards fmcs mobile doctor soil experts conduct landspecific nutrient tests and provide growers with tailored micronutrient solutions 1 7,0.0,1.0,7.0
FMC Corporation,FMCCorp,2019-11-29,fmc was highly commended for its rd pipeline during this past awards event we have expanded our innovation infrastructure and strengthened our rd pipeline that today includes new insecticides herbicides and fungicides many featuring new modes of action 9 18,0.0,9.0,18.0
FMC Corporation,FMCCorp,2017-12-08,fmc will be a bronze sponsor of the ag showcase presented by agribusiness managementnational agricultural marketing association club abmnama and we couldnt be more excited to see what the future of ag has to hold see you all in january 1 2,0.0,1.0,2.0
FMC Corporation,FMCCorp,2018-07-05,fmc will release its second quarter 2018 earnings on wednesday august 1 2018 after the stock market close we will host a webcast conference call on thursday august 2 2018 at 900 am et details available at 5,0.0,0.0,5.0
Indian Chemical News,chemical_news,2022-04-27,fmc wins patent infringement case against udragon indianchemicalnewscom fmc wins patent infringement case against udragon the court found udragon infringed on fmcs patent for a key intermediate chemical used in the manufacturing of chlorantraniliprole by conducting field trials,0.0,0.0,0.0
FMC Corporation,FMCCorp,2020-03-13,fmc would like to recognize all the as we continue this takeover take a look at some of the proud who work here at fmc 2 17,0.0,2.0,17.0
FMC Corporation,FMCCorp,2019-11-28,fmc would like to wish a happy thanksgiving to our employees and customers who will be celebrating the holiday today have a safe and joyous holiday 1 5 11,1.0,5.0,11.0
FMC Corporation,FMCCorp,2020-12-25,fmc would like to wish all those who celebrate a merry christmas 2 22,0.0,2.0,22.0
FMC Corporation,FMCCorp,2020-12-26,fmc would like to wish all who celebrate a happy kwanzaa 1 5,0.0,1.0,5.0
FMC Corporation,FMCCorp,2019-06-10,fmcs 2018 sustainability report unveils our six core values that define who we are and how we do business its what sets fmc apart and its the key to our longterm growth and sustainability as a company 5 14,0.0,5.0,14.0
FMC Corporation,FMCCorp,2019-09-25,fmcs aman chandi was featured as a take a look at the evergrowing list of by clicking the link 1 6,0.0,1.0,6.0
FMC Corporation,FMCCorp,2018-07-09,fmcs approach to advancing sustainable agriculture centers on a diversified approach to crop protection and plant health in 2017 we clarified our strategy and began expanding our plant health business which consists of three categories 1 2,0.0,1.0,2.0
FMC Corporation,FMCCorp,2020-07-15,fmcs director of corporate sustainability linda froelich writes about the companys awardwinning product stewardship and sustainability assessment pssa tool read the full article here 1 5 25,1.0,5.0,25.0
FMC Corporation,FMCCorp,2021-05-28,fmcs director of discovery chemistry at our stine research center in newark delware seva rostovtsev sat down with the american chemcal society for a qa covering his work the pandemic and much more click the link to read the full interview 5 17,0.0,5.0,17.0
FMC Corporation,FMCCorp,2020-02-14,fmcs diversity and inclusion di group launched its newest employee resource group erg honor veterans honors mission is to promote veterans and family and friends of the military in their careers at fmc and to help recruit and retain employees who are veterans 1 7,0.0,1.0,7.0
FMC Corporation,FMCCorp,2020-12-17,fmcs dr rakim turnipseed will be joining s environmental scientist dr rachel valletta to discuss the spotted lantern fly and how companies like fmc develop products to mitigate its impact on our environment 11 am on their facebook live 4 6,0.0,4.0,6.0
FMC Corporation,FMCCorp,2019-10-16,fmcs early order program makes it more valuable than ever to choose fmc products our new rebatelock feature and more inseason savings opportunities the 2019 fmc eop lasts all of next season select your industry and eligible products at 1 4,0.0,1.0,4.0
FMC Corporation,FMCCorp,2019-05-23,fmcs future sure looks promising bethwyn todd may 22 2019 future ap leaders in town for art of leadership training at our singapore rhq office this week and their drawings are not bad either 2 9,0.0,2.0,9.0
FMC Corporation,FMCCorp,2020-11-10,fmcs inclusion month annual world cafe recipe competition was virtual this year but still received incredible recipes from all over the world take a look at some of our employees favorite dishes from asia pacific north america and latin america 13,0.0,0.0,13.0
FMC Corporation,FMCCorp,2019-12-20,fmcs latest specialty crops podcast features brent johnson technical service manager for fmc brent goes in depth to discuss the emerging pest and weather challenges for the 2020 leafy season in florida 3 11,0.0,3.0,11.0
FMC Corporation,FMCCorp,2018-06-01,fmcs lgbtq affinity group spectrum is celebrating with exciting activities planned throughout june including an employee education series events and a discussion with on the topic of covering stay tuned for more details 3 4,0.0,3.0,4.0
FMC Corporation,FMCCorp,2018-07-26,fmcs lithium business to be named livent corporation read more about livent below 2 4,0.0,2.0,4.0
FMC Corporation,FMCCorp,2018-02-08,fmcs multicultural affinity group the bridge is celebrating by spotlighting the accomplishments of black leaders and trailblazers in the us stay tuned for the first announcement tomorrow 1 7,0.0,1.0,7.0
FMC Corporation,FMCCorp,2019-09-27,fmcs new infurrow flutriafol formulation which helps protect corn plants through harvest shines in show plots read more farmprogresscom fmcs new infurrow fungicide shines in show plots farm progress slideshow the new flutriafol formulation helps protect corn plants all the way through harvest 4 7,0.0,4.0,7.0
FMC Corporation,FMCCorp,2020-07-24,fmcs new president and ceo mark douglas recently sat down for a qa with sanjiv rana of agrow to discuss his vision and strategy for the companys growth read the full article spglobalcom sharing insights elevates their impact 7 24,0.0,7.0,24.0
Rocketnews,Rocketnews1,2018-08-01,fmcs quarterly profit nearly doubles as lithium sales jump fmc corp the chemical producer spinning off its lithium division as a publicly traded company later this year posted a quarterly,0.0,0.0,0.0
FMC Corporation,FMCCorp,2019-10-30,fmcs renewed sustainability targets aim to achieve a more sustainable future for all of us our goals and initiatives correlate with the s sustainable development goals 5,0.0,0.0,5.0
FMC Corporation,FMCCorp,2021-03-18,fmcs stine research center in newark delaware has again received gold certification status with the wildlife habitat council whc gold status is the highest level given to corporations for their onsite commitment to wildlife conservation 2 10,0.0,2.0,10.0
FMC Corporation,FMCCorp,2020-02-20,fmcs top 5 business priorities per 2018 sr technology accelerate new ai focus on chemistry invest in rd marketdriven innovation engage customers empowered countries globally aligned regionally focused simplicity remain agile 5 13,0.0,5.0,13.0
Top Crop Manager,TopCropMag,2018-01-08,focus herbicide has received registration for use in front of lentils for broad spectrum grass and broadleaf weed control,0.0,0.0,0.0
FMC Corporation,FMCCorp,2019-12-28,following our transaction with dupont and the separation of our lithium business now from our core agricultural chemicals business fmc is now a pureplay agricultural sciences company 3 10,0.0,3.0,10.0
FMC Corporation,FMCCorp,2019-05-29,following the acquisition of assets from dupont in 2017 fmc recorded growth in 2018 that helped it leap ahead of competition hear from ceo pierre brondeau and president and coo mark douglas about the companys pre and postacquisition plans 5 15,0.0,5.0,15.0
FMC Corporation,FMCCorp,2019-07-29,food and agriculture organization jul 29 2019 indigenous are the guardians of the seeds and the keepers of traditional knowledge it is impossible to achieve about food security without empowering these heroes 1 3,0.0,1.0,3.0
Food Anaimal Feed Industry Trends,GlobFoodTrends,2019-02-06,food colorants market worth over usd 47 billion by 2024 top players read more 1,0.0,0.0,1.0
@ReportsandMarkets,ReportsandMarkets,2021-09-07,food thickener market is expected to grow at a healthy cagr with top players duponttate lylecp kelcoadmingrediondowbasfcargillfmc corpashland,0.0,0.0,0.0
FMC Corporation,FMCCorp,2018-11-27,for consider making the gift of a scholarship with our partners natl ffa foundation nov 27 2018 help us grow leaders build communities and strengthen agriculture with a gift to ffa on this your gift has real impact last year 27 million was awarded in the form of 188 scholarships join the movement on 2,0.0,0.0,2.0
Lynn Bannerman,lynnbannerman1,2021-04-18,for fmc corp upgrading to sap helped modernize a global landscape of systems and disparate business processes at sap news lloyd adams shares insights about this success story,0.0,0.0,0.0
Mary Joy Kimani,MaryJoy777,2021-04-16,for fmc corp upgrading to sap helped modernize a global landscape of systems and disparate business processes at sap news lloyd adams shares insights about this success story sapemeavoicestormcom sap get social sap get social,0.0,0.0,0.0
Red Cross Philadelphia,RedCrossPhilly,2019-02-14,for more than 100 years we have been there to help our communities in times of need thank you to our partner 3 1,0.0,3.0,1.0
FMC Corporation,FMCCorp,2019-10-02,for the first time fmc is a proud contributing sponsor of the pennsylvania conference for women a professional and personal development event learn more about the event at 2 5,0.0,2.0,5.0
GEOFFROY Philippe,GEOFFROYPhilip,2021-04-08,for upgrading to sap helped modernize a global landscape of systems and disparate business processes at shares insights about this success story sapemeavoicestormcom sap get social sap get social,0.0,0.0,0.0
Andreia Nobre Bessa,AndreiaNBessa,2021-04-06,for upgrading to sap helped modernize a global landscape of systems and disparate business processes at shares insights about this success story sapemeavoicestormcom sap get social sap get social 1,0.0,0.0,1.0
Nicole Sydney,NicoleSte,2021-04-01,for upgrading to sap helped modernize a global landscape of systems and disparate business processes at shares insights about this success story sapemeavoicestormcom sap get social sap get social 1 2,0.0,1.0,2.0
Chloropy,chloropy,2021-03-19,fpa approves fmcs drone use of prevathon insecticide in rice crop 1,0.0,0.0,1.0
YomiBlog,BlogYomi,2019-01-22,fred alger management has upped its holding in fmc corp fmc as stock value declined sabal trust co upped position in united parcel service ups by 559004 as share price declined,0.0,0.0,0.0
Enterprise Leader,EnterpriseLeade,2018-07-31,fred alger management inc acquires 39714 shares of fmc corp fmc,0.0,0.0,0.0
US Banking News,AmericanBanking,2018-03-13,fred alger management inc has 228 million position in fmc corp fmc,0.0,0.0,0.0
Enterprise Leader,EnterpriseLeade,2018-08-16,fred alger management inc purchases 39714 shares of fmc corp fmc,0.0,0.0,0.0
YomiBlog,BlogYomi,2019-01-25,fred alger management maintains stake in fmc corp fmc cohen lawrence b has increased holding in general dynamics com gd by 551820 as share value declined,0.0,0.0,0.0
Dave Childress,metaldc4life,2018-03-21,freedomwoninc fmc corps lithium business and outlook lithium capacity expansion plans,0.0,0.0,0.0
Dave Childress,metaldc4life,2018-01-16,freedomwoninc the best lithium stocks of 2017 how did sqm albemarle and fmc corp stack,0.0,0.0,0.0
Ride Fast | Drive Safe,tlongpine,2021-11-10,fresh new tarmac on hawaii ave ne making it ridable for cyclists but uh andor forgot to repaint the bike lane at taylor hawaii neat paradox bike lanes on unridable surfaces or rideable surfaces without bike lanes 1,0.0,0.0,1.0
FMC Corporation,FMCCorp,2019-04-26,from agritourism to finding a niche market there are plenty of ways to diversify your farms business increase your bottomline and tell your story read more below 3,0.0,0.0,3.0
CropLife America,CropLifeAmerica,2019-04-12,from the air from the ground will have new tools to help control check out these five innovative ways technology is helping in the fight against weeds 1,0.0,0.0,1.0
NatlCottonCouncil,NCottonCouncil,2022-07-19,from the ncc annual meeting to spending last week in dc our policy education program participants have been immersed in learning about ncc policy development and industry issues this program is supported by through a grant to the cotton foundation,0.0,0.0,0.0
Transcript Daily,TranscriptDaily,2018-01-18,frontier capital management co llc acquires 95036 shares of fmc corp fmc,0.0,0.0,0.0
Maximum Pest Control Services,maxipestcontrol,2019-02-09,frontier capital management co llc buys 37386 shares of fmc corp fmc fairfield current,0.0,0.0,0.0
Noah Olson,noah0ls0n,2019-08-21,full house at event with ud grad students and great night to make connections and learn about a great company 1 4,0.0,1.0,4.0
Bethwyn Todd,BethwynTodd,2019-05-22,future ap leaders in town for art of leadership training at our singapore rhq office this week and their drawings are not bad either 2 10,0.0,2.0,10.0
The Lincolnian,ThisLincolnian,2018-02-07,fy2017 eps estimates for fmc corp cut by seaport global securities fmc,0.0,0.0,0.0
WKRB News,WKRBNews,2018-02-08,fy2017 eps estimates for fmc corp decreased by analyst fmc,0.0,0.0,0.0
The Lincolnian,ThisLincolnian,2018-11-16,fy2018 eps estimates for fmc corp fmc cut by suntrust banks,0.0,0.0,0.0
Dakota Financial,dakotafinancial,2019-02-06,fy2018 eps estimates for fmc corp fmc increased by analyst,0.0,0.0,0.0
Community Financial,CFinancialNews,2018-12-10,fy2018 eps estimates for fmc corp fmc lifted by analyst,0.0,0.0,0.0
Transcript Daily,TranscriptDaily,2018-01-05,fy2018 eps estimates for fmc corp fmc lowered by jefferies group,0.0,0.0,0.0
MidEast Times,midetimes,2018-10-20,fy2018 eps estimates for fmc corp fmc lowered by seaport global securities,0.0,0.0,0.0
Dakota Financial,dakotafinancial,2018-11-10,fy2018 eps estimates for fmc corp reduced by gabelli fmc,0.0,0.0,0.0
Community Financial,CFinancialNews,2019-02-18,fy2019 eps estimates for fmc corp boosted by keycorp fmc,0.0,0.0,0.0
Watchlist News,WatchlistN,2019-02-19,fy2019 eps estimates for fmc corp fmc lifted by keycorp,0.0,0.0,0.0
The Lincolnian,ThisLincolnian,2018-11-13,fy2019 eps estimates for fmc corp fmc lowered by analyst,0.0,0.0,0.0
Community Financial,CFinancialNews,2020-05-08,fy2020 earnings forecast for fmc corp issued by keycorp fmc,0.0,0.0,0.0
WKRB News,WKRBNews,2018-12-07,fy2020 eps estimates for fmc corp lowered by jefferies financial group fmc,0.0,0.0,0.0
MidEast Times,midetimes,2019-06-13,fy2021 eps estimates for fmc corp boosted by jefferies financial group fmc,0.0,0.0,0.0
Community Financial,CFinancialNews,2019-03-22,fy2021 eps estimates for fmc corp cut by analyst fmc,0.0,0.0,0.0
Community Financial,CFinancialNews,2020-02-10,fy2021 eps estimates for fmc corp cut by gresearch fmc,0.0,0.0,0.0
Community Financial,CFinancialNews,2019-05-10,fy2022 earnings forecast for fmc corp issued by jefferies financial group fmc,0.0,0.0,0.0
MarketBeat,MarketBeatCom,2019-02-19,gabelli analysts increase earnings estimates for fmc corp fmc,0.0,0.0,0.0
The Lincolnian,ThisLincolnian,2019-02-18,gabelli weighs in on fmc corps fy2019 earnings fmc,0.0,0.0,0.0
FMC Corporation,FMCCorp,2019-10-11,gail stratman fmc regional technical service manager caught up with earlier to talk about exciting new technology to treat plant disease earlier in the season watch the full video at 2 8,0.0,2.0,8.0
Plant Registrations,PlantReg,2021-01-28,gallagher and iba hard red winter wheat halfsibs inseparable by yield gain separable by producer preference 1,0.0,0.0,1.0
Transcript Daily,TranscriptDaily,2018-01-28,gateway investment advisers llc sells 981 shares of fmc corp fmc,0.0,0.0,0.0
Schuylkill Banks,SchuylkillBanks,2019-06-20,gather your friends head down to grays ferry crescent tonight to watch the karate kid 1984 get there early for free snacks to enter a free raffle for gift cards to or thanks to our sponsors 2 5,0.0,2.0,5.0
US Banking News,AmericanBanking,2018-03-10,geode capital management llc has 13365 million position in fmc corp fmc,0.0,0.0,0.0
FMC Corporation,FMCCorp,2019-12-21,get the most uptodate and information on that came out in 2019 with s list of top reports croplifeorg best reports from 2019 list of top agricultural reports from last year 5,0.0,0.0,5.0
Matthew Wiggins,matt_wiggins88,2020-03-27,getting a new 3rive unit up and running in west tn good day in the field with great company 2 4 28,2.0,4.0,28.0
CPM Magazine,cpm_magazine,2018-02-12,getting foliar nutrition right means a healthier crop and can give yields a welcome boost cpm seeks some advice on how to get the best results 3,0.0,3.0,0.0
FMC Corporation,FMCCorp,2018-04-12,getting ready for the big climb be sure to join and corefitness for the upcoming big climb clinic taking place sunday april 22nd at 10am on the art museum steps not able to climb use this link to donate,0.0,0.0,0.0
FMC Corporation,FMCCorp,2019-10-30,getting ready see you all tomorrow at 330 pm in the 1 1 12,1.0,1.0,12.0
FMC Corporation,FMCCorp,2018-02-04,getting ready to host your own party be sure to follow the s tips 2 3,0.0,2.0,3.0
FMC Corporation,FMCCorp,2018-09-11,getting the best and the brightest young talents 3 12,0.0,3.0,12.0
FMC Corporation,FMCCorp,2020-04-03,give a listen to episode 12 of fmcs podcast on specialty crops and learn about some of the challenges growers could face in 2020 aside from covid19 1 8,0.0,1.0,8.0
FMC Corporation,FMCCorp,2019-02-21,glad to see that you are still shining james t alfred feb 19 2019 my first job out of college was with the i was a young bright shinning star when we met twenty three years later were both still standing how you doing 1 1,0.0,1.0,1.0
Catalyst SDC,CatalystSDC,2018-09-26,glad you are having a great time thanks to sponsored visit from willaston ce primary sep 26 2018 y6 exploring and having a great time 1 2,0.0,1.0,2.0
sri kavya,Srikavyaa_s,2019-03-05,global biopesticide market is expected to get increased from usd 336 billion in 2017 to usd 882 billion with cagr of 174 from 2017 request a sample report,0.0,0.0,0.0
David DiGregorio,Darodi,2019-02-26,global chitin derivatives market 20192025 advanced biopolymers as norway fmc corp us goldenshell pharmaceutical co ltd china,0.0,0.0,0.0
Andy Brosman,B9Andy,2018-09-12,global chitosan derivatives market 2018 forecast and share kunpoong bio fmc corp kitozyme and bio21,0.0,0.0,0.0
Kevin,muenchkevin7,2018-08-26,global chitosan derivatives market 2018 future projection bio21 fmc corp kitozyme and kunpoong bio,0.0,0.0,0.0
Robert Martin,generalcriticsm,2018-12-14,global chitosan derivatives market 2018 kunpoong bio bio21 kitozyme and fmc corp,0.0,0.0,0.0
Connectivity Market,MatildaJohn8,2018-10-02,global chitosan derivatives market 2018 share and development bio21 kitozyme fmc corp and kunpoong bio,0.0,0.0,0.0
Andy Brosman,B9Andy,2018-12-28,global chitosan derivatives market 2018 top trends bio21 kitozyme kunpoong bio and fmc corp,0.0,0.0,0.0
Connectivity Market,MatildaJohn8,2018-12-20,global chitosan derivatives market outlook 20182023 fmc corp bio21 kitozyme and kunpoong bio,0.0,0.0,0.0
The Chief Observer,RobinDr42814591,2018-12-10,global chitosan derivatives market outlook 201823 fmc corp bio21 kunpoong bio and kitozyme,0.0,0.0,0.0
People Exclusive,PeoplExclusive,2018-11-26,global chitosan derivatives market research analysis 2018 kitozyme bio21 fmc corp and kunpoong bio,0.0,0.0,0.0
QY Research,robertscholz03,2018-11-03,global chitosan derivatives market share 201823 kitozyme kunpoong bio bio21 and fmc corp,0.0,0.0,0.0
Incredible News 24,news_incredible,2018-04-12,global chitosan derivatives market study 2018 yaizu suisankagaku heppe medical chitosan fmc corp bio21 and kitozyme,0.0,0.0,0.0
chitti_123,chitti_cs,2019-07-16,global fishmeal fish oil market is estimated to be valued at usd 950 billion in 2018 and projected to reach usd 1432 billion by 2024 at a cagr of 858 from 2017 request free sample,0.0,0.0,0.0
