User,Handle,PostDate,TweetText,ReplyCount,RetweetCount,LikeCount
FMC Corporation,FMCCorp,2019-06-14,core value respect for people we empower informed risktaking celebrating successes and learning from mistakes and we develop the knowledge and abilities of our people to best serve their careers and our customers 6,0.0,0.0,6.0
FMC Corporation,FMCCorp,2019-06-12,core value safety we empower employees to always put safety first we help others to be safe at work at home and on the road 1 12,0.0,1.0,12.0
FMC Corporation,FMCCorp,2019-06-13,core value sustainability we create innovative solutions while preserving the environment for tomorrow we make a positive impact on the communities where we live and work 8,0.0,0.0,8.0
Chemical Outlook,chemoutlook,2018-06-27,corinthian colleges inc coco fmc corp fmc the climb of the dow,0.0,0.0,0.0
Austin Howell,Austin08Howell,2021-04-06,corn planting in west tennessee is wide open after years of proven research and plots im excited to see xyway finally hitting the ground 9,0.0,0.0,9.0
Community Financial,CFinancialNews,2018-03-26,cornerstone capital management holdings llc acquires 11215 shares of fmc corp fmc,0.0,0.0,0.0
Guava India,Guava_India,2021-06-19,corona free villages a nobel initiative by to inform the farming community on good practices to save themselves from a series of multiple communication info motion 1 hindi,0.0,0.0,0.0
Indian Chemical News,chemical_news,2022-03-08,corprima is powered by fmcs worlds leading rynaxypyr insect control technology indianchemicalnewscom fmc introduces new insecticide corprima corprima is powered by fmcs worlds leading rynaxypyr insect control technology 1,0.0,0.0,1.0
Bethwyn Todd,BethwynTodd,2018-03-08,cosy lunchtime chat with some of our growing female team in singapore on proud that global ag leadership team reached gender parity in 2017 the di journey continues 8,0.0,0.0,8.0
FMC Corporation,FMCCorp,2018-12-05,could 2019 be a turnaround year for farmers here are ten predictions for farmers in 2019 6,0.0,0.0,6.0
FMC Corporation,FMCCorp,2021-04-30,counterfeit and illegal pesticides are a growing problem for the agriculture industry having negative effects on farmers manufacturers national economies and the environment alike learn more about this issue from croplifeorg through the eyes of the farmers how counterfeit pesticides can impact farmer livelihoods food croplife international is an association based in brussels belgium which promotes agricultural technologies such as pesticides and plant biotechnology 1 6 8,1.0,6.0,8.0
Legal Newsline,LegalNewsline,2018-05-15,court grants authority of new york entity to begin cleanup of fmc corp site recover costs,0.0,0.0,0.0
Storm Investor,storminvestor,2018-03-05,cove street capital llc has 914 million holdings in fmc corp fmc,0.0,0.0,0.0
US Banking News,AmericanBanking,2018-03-05,cove street capital llc sells 71205 shares of fmc corp fmc,0.0,0.0,0.0
FMC Corporation,FMCCorp,2020-04-08,covid19 has had its effect nearly everywhere read s president ceo s personal note on the importance of supporting farmers to maintain a robust global food supply under the current circumstances 3 7,0.0,3.0,7.0
Free America Network,stand_4_america,2018-07-15,cramer remix dont let this buying opportunity pass again lithium stocks like fmc corp are under pressure but,0.0,0.0,0.0
Free America Network,stand_4_america,2020-05-13,cramer remix dont let this buying opportunity pass again lithium stocks like fmc corp are under pressure but freeamericanetworkcom cramer remix dont let this buying opportunity pass again free america network lithium stocks like fmc corp are under pressure but for cnbcs jim cramer the agricultural chemical play is flashing screaming buy signals im glad fmcs getting hit here because youre getting,0.0,0.0,0.0
Stock Market Intellects,smintellects,2019-02-13,credit suisse group cuts fmc corp nysefmc target price to 11200,0.0,0.0,0.0
Stock Market Intellects,smintellects,2019-03-01,credit suisse group cuts fmc corp nysefmc target price to 9600,0.0,0.0,0.0
SIAnalystWire,AnalystWire,2018-11-05,credit suisse reinstates fmc corp fmc at outperform streetinsidercom credit suisse reinstates fmc corp fmc at outperform credit suisse analyst christopher parkinson reinstates coverage on fmc corp nyse fmc with a outperform rating and a price target of 10300for an analyst ratings summary,0.0,0.0,0.0
The Lincolnian,ThisLincolnian,2018-01-17,crestpoint capital management llc has 79500 holdings in fmc corp fmc,0.0,0.0,0.0
Ameco Research,AmecoResearch,2019-04-05,crop micronutrients market to surpass us 11535 mn by 2025 healthy cagr at 855 know moreclick here 2,0.0,0.0,2.0
FMC Corporation,FMCCorp,2018-07-03,crop protection helps ensure that we receive quality produce especially in time for summer 1 3,0.0,1.0,3.0
CHS Agronomy,CHSAgronomy,2018-10-16,crop protection strategies for achieving high yields implementing sound crop protection strategies is an important step in the growing process via in the furrow blog,0.0,0.0,0.0
CHS Agronomy,CHSAgronomy,2018-06-03,crop protection strategies for achieving high yields with todays commodity prices producing the best possible yield is essential to a growers success via in the furrow blog cc 1,0.0,0.0,1.0
Alexander Silverwood,Agronomysilvers,2020-08-27,crop walking with today on nadine potatoes yielding well on very sandy slits soils ready for desiccation 3 4,0.0,3.0,4.0
FMC Corporation,FMCCorp,2018-11-27,croplife asia recently announced that bethwyn todd fmc asia pacific president will head up its new board of directors lineup read the full release at 1 4 6,1.0,4.0,6.0
Matthew Cossey,Matthew_Cossey,2018-02-18,croplife australia is fortunate to have great members like who are genuine thought leaders and committed to supporting the broader agricuilture sector through initiatives like fmc corporation feb 17 2018 fmc is proud to support the future leaders of agriculture as they begin their celebration of national ffa week today see the impact of your support here happy national 1,0.0,0.0,1.0
CMFE Research,CmfeResearch,2018-08-24,crystal crop expands portfolio acquires four brands from fmc,0.0,0.0,0.0
VCCircle,vccircle,2018-08-17,crystal crop may brands of fmc corp sun petrochemicals eyes assam co assets,0.0,0.0,0.0
VCCircle,vccircle,2018-08-17,crystal crop may brands of fmc corp sun petrochemicals eyes assam co assets 1,0.0,0.0,1.0
VCCircle,vccircle,2018-08-20,crystal crop protection buys four brands from us firm,0.0,0.0,0.0
Jordan Brisebois,JordanBrisebois,2018-06-09,cs1002525 plus perimeter and mcpa smoking volunteer canola in cdc alloy durum north of gravelbourg for the win it was also melting round leaved mallow kochia and nlhb 1 1 7,1.0,1.0,7.0
INDIA CSR,INDIACSR,2021-09-15,csr fmc corporation inaugurates oxygen pressure swing adsorption plant at a rural hospital in indore indiacsrin csr fmc corporation inaugurates oxygen pressure swing adsorption plant at a rural hospital in fmc india inaugurated a pressure swing adsorption psa oxygen plant it donated to the aranya hospital in scheme number 74 1,0.0,1.0,0.0
INDIA CSR,INDIACSR,2021-09-07,csr fmcs samarth promotes water stewardship and sustainable agriculture in india 1 1,0.0,1.0,1.0
INDIA CSR,INDIACSR,2021-05-01,csr pledges 7 pressure swing absorption plants for covid19 relief indiacsrin csr fmc corporation pledges 7 oxygen pressure swing absorption plants for covid19 relief fmc india announced its commitment towards covid19 relief measures in india which will focus on enhancing the oxygen supply at 1 3,0.0,1.0,3.0
DopamineDividend,simpsjm1,2022-05-10,ctva corteva dd dupont dow dow inc fmc fmc corp hrl hormel ipi intrepid potash land gladstone land corp mos mosaic ntr nutrien ppc pilgrims pride sgm scotts miracle grow tsco tractor supply tsn tyson foods do you hold any of these 2 2,2.0,0.0,2.0
FMC Corporation,FMCCorp,2020-04-23,curious as to what steps take to prevent pests and disease using integrated pest management check out the infographic to learn more 2 2 10,2.0,2.0,10.0
John Touey,JohnTouey,2018-06-29,current and former clients and get high marks for via inquirercom we rank philly companies on diversity governance transparency the winners may surprise you the sray scores measure how a company behaves in society and how well a company manages business risks so how did philadelphiaarea companies rank 3,0.0,0.0,3.0
RealAgriculture,realagriculture,2021-04-23,current studies show s new mode of action herbicide provides seasonlong control of important grass weeds in the rice market as well as key hardtocontrol broadleaf weeds and sedges 2,0.0,0.0,2.0
The Markets Daily,TheMarketsDaily,2018-01-19,cwm llc has 151 million holdings in fmc corp fmc,0.0,0.0,0.0
Homologa: the Global Crop Protection Database,Homologa_data,2019-12-17,cyprus registered a new fungicide on several crops peaches apples pears grapes tomatoes aubergines peppers strawberries wheat and barley impact 125 sc flutriafol 1,0.0,0.0,1.0
FMC Corporation,FMCCorp,2019-08-09,daniel carrothers fmc commercial director professional solutions fmc global specialty solutions talks about the three things that make the lawn care industry watch here unique 2,0.0,0.0,2.0
FMC Corporation,FMCCorp,2019-07-29,daniel carrothers fmc commercial director professional solutions fmc global specialty solutions talks about the three things that make the lawn care industry watch here unique 9 22,0.0,9.0,22.0
ArcticStartup,arcticstartup,2022-07-14,danish biotech startup biophero is acquired by the global agricultural sciences company via arcticstartupcom danish biotech startup biophero is acquired by the global agricultural sciences company arctics founded in copenhagen as a spinout from the technical university of denmark biotech startup biophero is acquired by fmc corporation an american chemical 2 1,0.0,2.0,1.0
Liliana Cano,Cano_Lab,2021-05-13,day 1 thanks to president the organizing team teams joe gasper dewayne hyatt speakers career panelists 3 9,0.0,3.0,9.0
FMC Corporation,FMCCorp,2018-06-18,de gov carney joins pierre brondeau ceo and chairman and mark douglas president and chief operating officer at fmcs stine research center to learn about crop protection chemistries from vinod kumar director of discovery biology governor john carney 4 11,0.0,4.0,11.0
Noah Olson,noah0ls0n,2021-02-12,deadline for funding competition for founders extended check out for more infoover 260k in prizes new deadline 22 thx to all of the sponsors delaware division of small business and 8 others 2 5,0.0,2.0,5.0
Pramod Thota,pramod_thota,2022-06-02,deeply humbled and grateful for the opportunity to lead our apac team a huge shout out to my mentor coach and friend who is leaving behind an indelible legacy and a sustainable business platform poised for growth in years to come fmc apac jun 1 2022 fmc has announced that effective july 1 will be president of fmc asia pacific he takes over from who will be missed by all of us in apac more details about this transition here 3 1 19,3.0,1.0,19.0
FMC Corporation,FMCCorp,2020-09-10,delaware state university is one of the 1890 land grant universities celebrating their 130th anniversary fmc is proud to support a partnership with dsu that mentors future scientists and connects students with our own rd scientists across a variety of disciplines and expertise 10,0.0,0.0,10.0
Ben duPont,BenjaminduPont,2022-01-28,delawares largest startup competition will be on may 22nd 2022 with cash awards of 250k it is sponsored by discover bank neofestorg neofest 4 10,0.0,4.0,10.0
TechSci Research,TechSciResearch,2020-08-20,demand for firmed up during 20152019 and the is likely to grow at a cagr of 51 through 2030 2,0.0,0.0,2.0
IndustryARC™,IndustryARC,2021-04-26,demand for will witness a cagr of 35 during the forecast period of 2019 to 2025 keyplayers,0.0,0.0,0.0
LatinRisk Argentina,LatinRisk,2017-12-21,deputies of the party of the former could complicate the expansion of in will the local and its minister succeed el inversor em dec 21 2017 online inversor energtico minero catamarca aprobar convenio por el litio pero con disidencias 1,0.0,1.0,0.0
Community Financial,CFinancialNews,2018-03-15,deutsche bank ag reduces position in fmc corp fmc,0.0,0.0,0.0
Dakota Financial,dakotafinancial,2018-03-15,deutsche bank ag sells 6804 shares of fmc corp fmc,0.0,0.0,0.0
FMC Corporation,FMCCorp,2018-06-08,dialogue can be a catalyst for change thats why we partnered with to discuss all things lgbtq today celebrations continue at our ewing site need support go here,0.0,0.0,0.0
Bethwyn Todd,BethwynTodd,2018-08-29,did we miss the memo about the green dress code great time talking product stewardship and sustainability with the farmers of can tho vietnam saurin 3 17,0.0,3.0,17.0
CropLife International,CropLifeIntl,2019-09-09,did you hear farmers have less cancer overall than the general population whew,0.0,0.0,0.0
Landscape Management,LandscapeMgmt,2021-06-14,did you hear that will give away a ford f150 at our learn how to register for the summit and the giveaway graphic lm staff landscapemanagementnet fmc to give away ford f150 at lm growth summit landscape management fmc will give away a new ford f150 truck at this years lm growth summit to mark the 25th anniversary of the registration of talstar insecticide 1,0.0,0.0,1.0
CropLife International,CropLifeIntl,2019-09-22,did you know it takes on average 11 years for a crop protection product to be approved while most of the data submitted to the regulatory authorities is already available to the public 4 8,0.0,4.0,8.0
CropLife International,CropLifeIntl,2019-09-11,did you know it takes on average 11 years for a crop protection product to be approved while most of the data submitted to the regulatory authorities is already available to the public 7 10,0.0,7.0,10.0
CropLife International,CropLifeIntl,2020-05-20,did you know the global honeybee population has risen by nearly 26 since 1995 see how the farmers and beekeepers are working together to protect the worlds pollinators 9 14,0.0,9.0,14.0
FMC Corporation,FMCCorp,2017-12-21,digital beets tune into the first episode of with today we are meeting alexis tordeur from tereos for an introduction to his interactive beets and details of their functionality watch here 2 3,0.0,2.0,3.0
Fruit & Vegetable Mag,fruitandvegmag,2018-07-20,dillenbeck leading efforts to explore new market opportunities and grow fmcs presence,0.0,0.0,0.0
MarketBeat,MarketBeatCom,2018-09-01,dirk a kempthorne purchases 1173 shares of fmc corp fmc stock,0.0,0.0,0.0
PMP Magazine,PMP_magazine,2022-03-31,discover mosquito treatments and control equipment needs during todays with register now to follow along 1,0.0,0.0,1.0
Landscape Management,LandscapeMgmt,2022-03-31,discover mosquito treatments and control equipment needs during todays with register now to follow along 1 1,0.0,1.0,1.0
Raju Kapoor,rajukap,2021-11-03,discussed key challenges with planet outlook editor on future farming sustainability how is india trying to address some of these pl click here to know more via planetoutlookindia and 9 others 4 11,0.0,4.0,11.0
RISE,PestFacts,2019-05-23,discussing pest control options at the 2019 california agricultural commissioners and sealers association spring conference,0.0,0.0,0.0
Sarah Daily,SarahDaily2,2018-08-14,display at 610ths of an ounce 32 oz of dropp and 32 oz of ethephon on the upper gulf coast 1 3 9,1.0,3.0,9.0
Dividend Reditus,DividendReditus,2020-07-18,dividend announcement com newfmc corp nysefmc on 07172020 declared a,0.0,0.0,0.0
REurope,reurope_stock,2019-01-24,do institutional investors hate fmc corp fmc,0.0,0.0,0.0
NASDA Foundation,NASDAFoundation,2020-02-23,do not be scared of the unknown ryan locke 4 5,0.0,4.0,5.0
Penn MES & MSAG,Penn_MES_MSAG,2018-09-10,do you ever wonder what mes students do during the summer mes student valerie vincent interned with fmcs global sustainability team 3 3,0.0,3.0,3.0
Ag Retailers Assoc.,AgRetailers,2019-03-05,do you have a crisis management plan in place when was the last time you reviewed it join us next month for an indepth workshop seating is limited get registered 1 1,0.0,1.0,1.0
CropLifeIndia,CropLifeIndia,2022-04-20,do you know how to handle and apply pesticides hope you didnt miss part 1 3 8,0.0,3.0,8.0
CropLifeIndia,CropLifeIndia,2022-04-18,do you know how to handle and apply pesticides stay tuned for part 2 1 2 4,1.0,2.0,4.0
FMC Corporation,FMCCorp,2019-04-06,do you know someone that should be a foodhero click the link to submit 4,0.0,0.0,4.0
CropLifeIndia,CropLifeIndia,2022-05-01,do you know why biodiversity is so important check this 1,0.0,0.0,1.0
Birchip Cropping Group (BCG),BCG_Birchip,2018-06-29,do you recognise this bug this is ladybird larvae its a big help to your crop as it eats pest insects this larval stage is responsible for most of the predation bcg staff have been brushing up on their ipm knowledge today with thanks to ipm technologies 1 9 20,1.0,9.0,20.0
WhatsOnThorold,whatsonthorold2,2018-11-15,does fmc corp fmc look attractive now buckingham research initiates coverage,0.0,0.0,0.0
FMC Corporation,FMCCorp,2018-07-20,dont be shy talk about crop protection 1 5,0.0,1.0,5.0
Certified Crop Adviser,CCASoundAdvice,2018-01-09,dont forget register for free webinar new strategies on managing corn rootworm resistance sponsored by,0.0,0.0,0.0
FMC Corporation,FMCCorp,2019-06-07,dont forget to keep up to date on your newest from click the link to check it out 3 8,0.0,3.0,8.0
FMC Corporation,FMCCorp,2020-03-02,dont forget to sign up for the crisis preparedness workshop in philadelphia pa that takes place next week sign up today to create a personalized emergency action plan 2 4,0.0,2.0,4.0
FMC Corporation,FMCCorp,2019-08-09,dont forget to tune in later to this webinar led by fmc insecticide technical manager brian mount with over 18 years of experience hell share tips and effective methods to gain true 90day pest control 3 6,0.0,3.0,6.0
FMC Corporation,FMCCorp,2019-11-05,dont forget to vote pflag national nov 5 2019 you have the right to its use it wisely 2,0.0,0.0,2.0
FMC Corporation,FMCCorp,2018-08-10,dont let misleading information about pesticide risk discourage you from eating your fruits and vegetables get the facts 3 10,0.0,3.0,10.0
DESCA,DescaDelaware,2021-01-22,dont miss out on exploring the possibilities available to you in stem and connecting with the innovative companies in the region meet the speakers brian horsey lisa stoner torbert bryan tracy casey welch 1,0.0,1.0,0.0
DESCA,DescaDelaware,2021-03-04,dont miss out register today be among the already 400 registrants registration closes on march 13 1 1,0.0,1.0,1.0
"Trade Alerts, Trade Ideas and Crypto",AlertTrade,2019-02-11,down with earnings today alert fmc fmc corp tradeideas via to free trading room,0.0,0.0,0.0
"Trade Alerts, Trade Ideas and Crypto",AlertTrade,2019-12-19,downside momentum alert fmc fmc corp tradeideas via to free trading room,0.0,0.0,0.0
Jaba Jagdish,Jabajagdish,2019-11-11,dr axel dinter chair ipm 2 session and delivering hisb lead talk on ryanaxpyrchlorantraniliprole insecticide with low toxicity to natural enemies and pollinators and effective against major lepidopteran pests armyworm 1 1 9,1.0,1.0,9.0
Luis Cifuentes,NMSUVPR,2019-11-04,dr immo hansen professor of biology is funded by to test the efficacy of mosquito repellent with fmcs necromones formulation 1 3,0.0,1.0,3.0
UFIFAS_IndianRiverREC,UFIFAS_IRREC,2019-09-13,dr irfan sohail recently completed a phd at the university of agriculture faisalabad pakistan he was a visiting scholar in dr zhenli hes laboratory last year today he is employed with fmc corp pakistan as a technical advisor fertilizer congratulations dr sohail 4,0.0,0.0,4.0
CropLifeIndia,CropLifeIndia,2018-11-26,dr sushil desai spoke on and use of at 2018 croplifeindia 2 5,0.0,2.0,5.0
⚘ Plant Lady,tinatheplantdoc,2019-03-19,driver safety course today i really liked the slide car glad my dad taught me how to drive in snow otherwise i wouldve been freaking out be safe on those roads 3 10,3.0,0.0,10.0
Enterprise Leader,EnterpriseLeade,2018-08-16,dupont capital management corp has 112 million position in fmc corp fmc,0.0,0.0,0.0
"Trade Alerts, Trade Ideas and Crypto",AlertTrade,2019-02-01,dynamo gaps up fmc fmc corp via to free trading room,0.0,0.0,0.0
FMC Corporation,FMCCorp,2019-06-08,earlier this week we launched our 2018 sustainability report be sure to follow over the coming weeks to follow our journey to an agricultural sciences company youtubecom fmc sustainability 2018 report during the past 10 years we took several important actions to transform fmc from a highly diversified chemical company into an enterprise focused on crop pr 1 10,0.0,1.0,10.0
CHS Agronomy,CHSAgronomy,2020-03-30,early stages of growth are critical to maximizing yield lift partner shares ways growers can protect their crops against soilborne this spring,0.0,0.0,0.0
Traders Community,TradersCom,2019-02-12,earnings monday feb 11 spx esf qq after market close amkor tech amkr compass minerls cmp dcp midstream dcp elevate credit elvt farmer bros farm fmc corp fmc molina moh omega healthcare ohi star bulk carrs sblk 1,0.0,1.0,0.0
Thieme Chemistry,thiemechemistry,2022-02-19,ecabmember shengying hsieh from fmc corporation is one of our members of the read about his inspiring thoughts why the global is equally important for to support 2 8,0.0,2.0,8.0
Canadian Agri-food Marketers Alliance,CAMA_ACAM,2019-11-15,email marketing winner fmc of canada for bayou burnoff contest by kahntact 1 3,0.0,1.0,3.0
Raju Kapoor,rajukap,2020-12-02,embracing newer and that drive of is the way for to become a global hub of president of urges at 9th conference arranged by ficci dec 1 2020 for india to become the global hub of agro chemical industry means embracing new technologies innovation ms bethwyn todd asia pacific president fmc corporation at 9th agrochemicals conference organized by show this thread 3 15,0.0,3.0,15.0
FMC Corporation,FMCCorp,2021-05-26,encouraging women to take up leadership roles in agricultural and allied businesses an article by sanjay gopinath fmcs hr head for india and asean read the full article here hreconomictimesindiatimescom women leaders encouraging women to take up leadership roles in agricultural and allied businesses women leaders the need of the hour for players in the agricultural and allied sectors is to undertake strategic initiatives to seek and develop talent in line with organisational values and culture 4 12,0.0,4.0,12.0
Mohammad irfan,mohdirfanq,2019-09-27,enjoying our time at agri my featuring new baby in the malaysia portfolio good turnout useful insight 2 8,0.0,2.0,8.0
Delaware Prosperity Partnership @choosedelaware,Delaware Prosperity Partnership choosedelaware,2021-04-28,entrepreneur will join innovation authorities from and to judge the startup302 finals 9 am 429 register to watch at 2 2,0.0,2.0,2.0
InterCooler,intercooleronli,2020-04-29,envestnet asset management inc has 1586 million stake in fmc corp fmc,0.0,0.0,0.0
Crwe World,CrweWorld,2020-09-23,epa completes cleanup of fmc corp landfill superfund list,0.0,0.0,0.0
News Bakerrs,newsbakerrs,2020-09-22,epa completes cleanup of fmc corp landfill superfund list epa completes cleanup of fmc corp landfill superfund list region 02 new york after the completion of all cleanup work the us environmental protection agency epa has deleted the fmc corp bakerrsblogspotcom epa completes cleanup of fmc corp landfill superfund list epa completes cleanup of fmc corp landfill superfund list region 02 new york after the completion of all cleanup work the us enviro,0.0,0.0,0.0
buma kevin komia,BKomia,2020-09-22,epa completes cleanup of fmc corp landfill superfund list new york after the completion of all cleanup work the us environmental protection agency epa has deleted the fmc corp,0.0,0.0,0.0
Tasty Food,anderw0348,2017-12-21,epa settlement with fmc corp enforces federal pesticide safety protections,0.0,0.0,0.0
Raju Kapoor,rajukap,2021-06-12,episode 12 of the 20 episode and campaign by india in association with was streamed live to india today lets keep our villages and free join the campaign narendra singh tomar and 9 others 2 10,0.0,2.0,10.0
Raju Kapoor,rajukap,2021-06-13,episode 13 of 20 episode india initiative campaign for india streamed covering in and on protecting old age dwellers with niti aayog and 9 others 1 5,0.0,1.0,5.0
Raju Kapoor,rajukap,2021-06-14,episode 14 of the 20 episode india initiative on protecting from was aired today it covered how can support villagers in staying free the episodes are targeting 13 m villagers over the digital media across ministry of ayush and 9 others 1 5,1.0,0.0,5.0
Community Financial,CFinancialNews,2018-10-19,equities analysts offer predictions for fmc corps fy2018 earnings fmc,0.0,0.0,0.0
The Markets Daily,TheMarketsDaily,2018-02-21,equities analysts offer predictions for fmc corps q1 2018 earnings fmc,0.0,0.0,0.0
Ticker Report,TickerReport,2018-07-13,equities analysts offer predictions for fmc corps q2 2018 earnings fmc,0.0,0.0,0.0
InterCooler,intercooleronli,2019-08-07,equities analysts offer predictions for fmc corps q3 2019 earnings fmc,0.0,0.0,0.0
WKRB News,WKRBNews,2018-02-17,equities analysts set expectations for fmc corps q2 2018 earnings fmc,0.0,0.0,0.0
WKRB News,WKRBNews,2019-05-21,equities analysts set expectations for fmc corps q2 2019 earnings fmc,0.0,0.0,0.0
Enterprise Leader,EnterpriseLeade,2018-08-24,equities analysts set expectations for fmc corps q3 2018 earnings fmc,0.0,0.0,0.0
Homologa: the Global Crop Protection Database,Homologa_data,2019-11-20,estonia registered a new herbicide on potatoes and legumes toutatis damtec aclonifen clomazone 1,0.0,0.0,1.0
sri kavya,Srikavyaa_s,2019-03-13,europe mining chemicals market is valued at usd xx billion in 2017 and is projected to usd xx billion by 2024 at a cagr of xx request a sample report,0.0,0.0,0.0
