User,Handle,PostDate,TweetText,ReplyCount,RetweetCount,LikeCount
セルディト,stockinfo2110,2022-02-09,00 1 enphase energy inc 2 omnicom group inc 3 fmc corp 4 chipotle mexican grill inc 1 cvs health corp 2 incyte corp 3 nortonlifelock inc 4 amgen inc 2,0.0,0.0,2.0
セルディト,stockinfo2110,2021-11-03,00 1 fmc corp 2 gap inc 3 tmobile us inc 4 tapestry inc 1 activision blizzard inc 2 charles river laboratories international inc 3 paycom software inc 4 teleflex inc,0.0,0.0,0.0
セルディト,stockinfo2110,2021-11-03,0400 1 fmc corp 2 akamai technologies inc 3 gap inc 4 tmobile us inc 1 activision blizzard inc 2 charles river laboratories international inc 3 paycom software inc 4 teleflex inc,0.0,0.0,0.0
セルディト,stockinfo2110,2022-05-03,0400 1 western digital corp 2 monolithic power systems inc 3 catalent inc 4 devon energy corp 1 rockwell automation inc 2 expedia group inc 3 fmc corp 4 estee lauder cos cl a 1,0.0,0.0,1.0
FMC Corporation,FMCCorp,2018-11-28,18 was a success thanks for having us for more information on fmcs freedom pass program please go to indiana soy farmers nov 27 2018 jennifer maruszewski with discusses the new freedom pass program thank you for being todays key sponsor 1 3,0.0,1.0,3.0
Meenal Deshpande,MeenalDeshpan13,2021-09-01,2012 2022 download sample report key players,0.0,0.0,0.0
Raghuraj Panchabhai,RaghurajPa,2021-01-21,20122022 sample copy key players monsanto,0.0,0.0,0.0
Uttam Sharma,uttamsharma1414,2017-12-23,2017 industry growth projections in key product segments,0.0,0.0,0.0
FMC Corporation,FMCCorp,2018-01-09,2018 is kicking off today just in time for to show our support we will offer complimentary shuttle service details here 1,0.0,1.0,0.0
"US EPA - NJ,NY,PR,VI",EPAregion2,2021-01-11,2020 marked the 3rd year in a row that epa has deleted a historically high number of sites from the superfund npl in region 2 fmc corp dublin road landfill and hormigas groundwater plume were among the 27 sites deleted nationwide 1,0.0,0.0,1.0
FMC Corporation,FMCCorp,2019-05-04,739 166 viewers fmc corporation 7,0.0,0.0,7.0
CropLife Europe,CropLifeEU,2020-10-22,a 1st for ecpa thx can be a global leader a science grounded policy framework will help achieve it 6 16,0.0,6.0,16.0
CropLife International,CropLifeIntl,2020-09-24,a 1st for ecpa thx the eu can be a global leader in a policy framework grounded in science will help achieve it 1 3 8,1.0,3.0,8.0
CropLife International,CropLifeIntl,2020-12-11,a 1st for ecpa thx the eu can be a global leader in a policy framework grounded in science will help achieve it 3 8,0.0,3.0,8.0
CropLife International,CropLifeIntl,2020-10-28,a 1st for ecpa thx the eu can be a global leader in a policy framework grounded in science will help achieve it 6 15,0.0,6.0,15.0
SynBioBeta,SynBioBeta,2020-08-20,a biomanufacturing company at the forefront of synthetic biology announced a new partnership with agricultural sciences company to build the best and fastest pipeline for bringing new natural products to growers 6 13,0.0,6.0,13.0
ET HRWorld,ETHrWorld,2022-03-24,a global agricultural sciences company on thursday announced the appointment of satender k sighadia as its human resource head effective april 1 hreconomictimesindiatimescom fmc india appoints satender k sighadia as hr head hr news ethrworld sighadia has extensive experience of 21 years in the industry and has been with fmc for nine years,0.0,0.0,0.0
GESDA.global #ScienceDiplomacy #SciDiplo,GESDAglobal,2021-04-19,a leading company is using to try to create more resilient axioscom bioengineering stronger crops that can survive extreme weather researchers are using synthetic biology to tackle a range of problems in agriculture 1,0.0,0.0,1.0
FMC Corporation,FMCCorp,2018-08-15,a third of food produced for human consumption is lost each year to pests and diseases fmc is committed to securing the worlds food supply safely and sustainably 1 1,0.0,1.0,1.0
Jyoti Waghmare,JyotiWa58903971,2021-10-11,access full report 1,0.0,0.0,1.0
FMC Corporation,FMCCorp,2018-10-31,activities dont have to end in october here are some yearround employers strategies for advancing disability inclusion,0.0,0.0,0.0
FMC Corporation,FMCCorp,2019-05-10,agweek may 10 2019 mental health needs to be talked about heres my story 1 4,0.0,1.0,4.0
ChemistryMatters,AmChemMatters,2022-06-30,also serves as a good steward of its space in the newark de community in addition to working with local students to provide they also designate portions of their test farm as and plant sunflowers along the border of their property 1 2 4,1.0,2.0,4.0
Bhagirath Choudhary,BiotechCentre,2019-03-16,an initiative by is to safeguard agriculture farmers against india has to succeed against this voracious pest at any cost more about project raju kapoor mar 16 2019 launches partnership to combat cropthreatening in south sudan we invite to partner in 1,0.0,0.0,1.0
Ayanna Alexander,aalex413,2018-05-30,and aim to squish in lawsuit via the following media includes potentially sensitive content change settings view,0.0,0.0,0.0
IRI the Innovation Research Interchange,IRIweb,2019-03-11,and are excited to be partnering on the 2019 innovation leaders speaker series an evening with pierre brondeau ceo chairman of the board wednesday march 20th 530pm800pm temple university main campus rsvp by march 15th,0.0,0.0,0.0
IRI the Innovation Research Interchange,IRIweb,2019-03-05,and are excited to be partnering on the 2019 innovation leaders speaker series an evening with pierre brondeau ceo chairman of the board wednesday march 20th 530pm800pm temple university main campus rsvp by march 15th 1,0.0,1.0,0.0
Jed Dean,JedDean_,2020-08-21,and are partnering with nature to accelerate the development of novel natural crop protection 1,0.0,0.0,1.0
The Microbiome Times,MicrobiomeTimes,2018-06-08,and extend collaboration on natural crop protection,0.0,0.0,0.0
FMC Corporation,FMCCorp,2019-11-18,and had a strong showing at the awards pointofpurchase material authority herbicide diecut pop email marketing bayou burnoff contest radio series fmc herbicides advertorials fmc command herbicide 1 5,0.0,1.0,5.0
Jordan Brisebois,JordanBrisebois,2018-08-19,and i received this picture from so thats where the credit belongs for this photo the left is glyphosate and the right is authority supreme and aim in from of chickpeas im thinking the grower is happy 1 8 12,1.0,8.0,12.0
Jordan Brisebois,JordanBrisebois,2018-08-19,and i received this picture from today so photo credit to her the left is a glyphosate burn off and the right is authority supreme and aim i am guessing the grower is happy 1,0.0,0.0,1.0
Raju Kapoor,rajukap,2021-09-01,and india work on advancing with sharing fmc indias vision on water youtubecom planet outlook advancing water sustainability with ravi annavarapu on the occasion of watch ravi annavarapu president fmc india talk about advancing water sustainability with outlooks special projec 3,0.0,0.0,3.0
Quentin R. PhD,QuentinRomar,2019-08-22,and strategy meeting on talent 1 2,0.0,1.0,2.0
IITMAA,IITMAA,2021-06-30,announced the appointment of as the new president of fmc india effective from july 1 2021 ravi is an alumnus of congratulations from for more information visit bwpeoplebusinessworldin fmc corporation ropes in ravi annavarapu as president of its india business news and updates for hr professional in india movementsannavarapu will succeed pramod thota who is taking on the role of president of fmc usa annavarapu will report to bethwyn todd fmc vice 1 1,1.0,0.0,1.0
PMP Magazine,PMP_magazine,2021-11-29,announced the winners of the talstar insecticide 25th anniversary sweepstakes which is part of a yearlong celebration of the brand mypmpnet fmc announces sweepstakes winners pest management professional fmc announced the winners of the talstar insecticide 25th anniversary sweepstakes which is part of a yearlong celebration of the brand,0.0,0.0,0.0
Project EverGreen,ProjectEvrGreen,2018-04-16,announces its officers and board of directors for 2018 dan carrothers of fmc corp will continue to serve as president through the end of 2018 when he will be succeeded by presidentelect joe shooner of focal point communications 1,0.0,0.0,1.0
AgTech Nexus,agtechnexus,2020-07-13,announces launch of fmc ventures first investment in fmc has identified that todays challenges are being addressed through among other verticals globalaginvestingcom fmc announces launch of fmc ventures first investment in trace genomics global aginvesting by lynda kiernan global aginvesting media fmc corporation announced the launch of its new capital venture arm fmc ventures to target strategic investments in innovative startups and earlystage,0.0,0.0,0.0
ReadMagazine,Read_Magazine21,2022-04-25,announces new greater than green sustainability platform renews longterm metrics readmagazinecom fmc corporation announces new greater than green global sustainability platform renews longterm fmc corporation announces new greater than green global sustainability platform renews longterm environmental metrics,0.0,0.0,0.0
Colin Chopelas,c_chopelas,2020-04-23,applying topguard eq for northern corn blight 2 7,0.0,2.0,7.0
PMP Magazine,PMP_magazine,2022-02-02,appointed jason hart as the key consumer manager for the pest northeast and northern territories submissions are now open to nominate professionals for the david cooksey pestvet of the year award which is sponsored by fmc and mypmpnet fmc appoints key customer manager opens nominations for pestvet award pest management professi fmc corp appointed jason hart as the key customer manager for the pest northeast and northern territories,0.0,0.0,0.0
Golfdom,Golfdom,2022-02-05,appointed matthew bradley who has over 20 years of experience in the industry as market specialist for the turf and ornamental central midwest territory learn more photo istock comokimo golfdomcom fmc adds matthew bradley as market specialist golfdom fmc appointed matthew bradley as market specialist for the turf and ornamental central midwest territory he has over 20 years of experience in the industry 2,0.0,0.0,2.0
FMC Corporation,FMCCorp,2019-04-25,are heavily engaged in the daytoday decisions along with record keeping and financial management check out the numbers below 5,0.0,0.0,5.0
Zach Serber,ZachSerber,2020-08-20,are proven leaders and innovators in this industry together we can solve old problems in new and better ways thanks and for elevating the discussion zymergenfmc partnership offers a peek into the future forbescom can technology make more natural pesticides zymergenfmc partnership offers a peek into the future zymergen a biomanufacturing company at the forefront of synthetic biology announced a new partnership with agricultural sciences company fmc corporation to develop new crop protection solutions to 2 1,0.0,2.0,1.0
Juliet Loiselle MInstR,JulietLoiselle,2019-09-24,are thrilled fmccorp is the 1st sponsor of the grower category for very 1st national potato industry awards thank you for your support the generosity of kind sponsors ensures we can recognise excellence within the potato industry,0.0,0.0,0.0
AHDB Potatoes,AHDB_Potatoes,2020-05-15,are you looking for advice for your crop listen to our latest podcast to learn what is the best practice when applying emerger or shark guest speakers from and link 3 4,0.0,3.0,4.0
James Marland,JamesMarland,2018-02-01,article mentions an awesome roll of companies using 1 1,0.0,1.0,1.0
James Marland,JamesMarland,2018-02-06,article mentions an awesome roll of companies using 2,0.0,0.0,2.0
diginomica,diginomica,2021-03-30,as lionel richie almost sang is it transformation youre looking for todays features s erp golive predicament explores the meaning of observability with and your dose of partner wisdom comes from gif alt 1 2,0.0,1.0,2.0
FMC Corporation,FMCCorp,2021-02-18,asked female farmers and scientists from around the world for their advice and words of wisdom about being check out their interactive map to see what they had to say croplifeorg in her own words plant science perspectives from global women hear from women across the globe who are engineering growing and adapting new technologies in the plant science industry 2 5,0.0,2.0,5.0
NPMA,NationalPestMgt,2020-03-09,attendees spent the morning stuffing care packages and writing letters to service members stationed overseas thank you to pestvets and for hosting this initiative for 1,0.0,0.0,1.0
Ros Lund,RosLund1,2018-04-04,attracting interest at 2018 expo 1,0.0,0.0,1.0
Andri Ete,andri000me_40,2018-03-21,automatedare chemical mining co of chile fmc corp and albemarle buys right now,0.0,0.0,0.0
CentralSpotter,centralspotter,2021-09-12,automatedn1088 corp challenger 605 alt 3700ft,0.0,0.0,0.0
CentralSpotter,centralspotter,2021-11-05,automatedn1088 corp states challenger 605 from to alt 3900ft seen 1 times,0.0,0.0,0.0
CropLife International,CropLifeIntl,2019-05-14,before a plant science innovation is released to the public it goes through a strict regulatory process to ensure the product is as safe effective as possible 4 9,0.0,4.0,9.0
CropLife International,CropLifeIntl,2019-05-08,before can use plant science innovations there are strict regulations to ensure they are as safe and effective as possible 7 11,0.0,7.0,11.0
FMC Corporation,FMCCorp,2018-08-09,biotechnology has helped increase farm incomes by over 100 billion 5,0.0,0.0,5.0
Uttam Sharma,uttamsharma1414,2017-12-16,by product application end user and geography global forecast to 2022,0.0,0.0,0.0
FMC Corporation,FMCCorp,2019-05-10,can help achieve amazing things to ensure safe and effective use innovations in the industry go through a robust regulatory process 2 10,0.0,2.0,10.0
Rahul,409rahul,2019-05-20,can you do a video on lithium supplier companies the 3 biggest players in the space rn are 1 albermarle corp alb 2 sociedad qumica y minera de chile sqm and 3 fmc corp fmc demand for li is going to rise in the coming years we should keep an eye out,0.0,0.0,0.0
Bhagirath Choudhary,BiotechCentre,2020-11-29,carried out multiple training programs on with akola parbhani in last 2 years farmers are now equipped to deal with however as say keep close eyes on to save maize dr ankush chormule nov 29 2020 replying to and 2 others kindly follow my article 3,0.0,0.0,3.0
Saurin,Saurin2344,2019-03-08,celebration at our manila office proud moments 3,0.0,0.0,3.0
2iQ,2iqresearch,2021-10-07,cfo coo buy 22500 shares in american agriculture sciences firm fmc with solid financials backing their investment 2iqresearchcom insider buying report fmc corp fmcus form 4 filings show top insiders at fmc corp fmcus just bought stock is this insider buying activity a bullish signal 1,0.0,0.0,1.0
2iQ,2iqresearch,2021-10-10,cfo coo buy 22500 shares in american agriculture sciences firm fmc with solid financials backing their investment 2iqresearchcom insider buying report fmc corp fmcus form 4 filings show top insiders at fmc corp fmcus just bought stock is this insider buying activity a bullish signal 2,0.0,0.0,2.0
Leadership Connect,LeadershipCnnct,2018-03-09,cfo to lead lithium materials company 1,0.0,0.0,1.0
Kiran Raheja,KiranRaheja1,2022-06-23,chemcon 2022,0.0,0.0,0.0
Ripesh Kumar Singh,kumarripesh,2020-09-04,clearly show the importance of agriculture in india it will change the way of thinking it should be 1 3,0.0,1.0,3.0
IowaAgRadioNetwork,IowaAgRadio,2017-11-03,closes transaction with 1,0.0,0.0,1.0
FMC Corporation,FMCCorp,2019-10-01,coffee has been fueling innovation for centuries but do you know what it takes in terms of land and resources to maintain our daily coffee habit 1 4,0.0,1.0,4.0
Tian_A1,Tian_A1,2020-06-05,cole of duty impact of corona on chitosan quaternary ammonium salt market growth and forecast fmc corp kitozyme heppe medical chitosan ak,0.0,0.0,0.0
American Chemistry,AmChemistry,2019-06-04,company of the year award winners and show unwavering leadership and commitment to tenets of 1 5,0.0,1.0,5.0
John Combest,JohnCombest_Ag,2019-12-16,company tops a cnote to hit alltime high in tough global ag environment fmc shares up nearly 60 ytd,0.0,0.0,0.0
AgWired.com,AgWired,2017-11-10,completes deal with dowdupont,0.0,0.0,0.0
Steve Kyryk,skyryk,2017-11-01,completing their transaction with,0.0,0.0,0.0
Jim Stokes,JAStokesNJ,2021-04-15,congrats to the entire team at on their new herbicide active ingredient,0.0,0.0,0.0
The American Chamber of Commerce in Singapore,AmChamSingapore,2021-04-16,congratulations to singapore for receiving the amchamrepresent business transformation award 2021 in supply chain transportation and logistics 1,1.0,0.0,0.0
Golfdom,Golfdom,2021-02-01,continues its give back to local chapters program for gcsaa chapters at the 2021 learn more here logo fmc golfdomcom fmc continues to give back to gcsaa chapters at 2021 gis golfdom the fmc professional solutions give back to local chapters program will commence at the upcoming virtual 2021 golf industry show 3 8,0.0,3.0,8.0
"Chris Rouse, PhD",crouse579,2019-02-13,continuing its support and showing its commitment to the future of weed science at the 2019 wssa annual meeting 1,0.0,0.0,1.0
Justin Ogle,Oglefarmsllc,2020-05-22,corn ear worm moth pressure for last 7 days cool temps suppressed activity protect before the bugs arrive 2 3,0.0,2.0,3.0
Saurin,Saurin2344,2018-07-02,corp farmer gathering in vietnam,0.0,0.0,0.0
AgriGate Global,AgrigateGlobal,2020-05-23,corporation has announced to launch a new precision platform arc farm intelligence it would enable the growers and advisors to predict the pest pressure accurately before it becomes a problem agrigateglobalcom fmc corporation announces new arc farm intelligence platform in an unprecedented move fmc corporation has announced to launch a new precision agriculture platform arc farm intelligenceit would enable the growers and advisors to predict the pest pressure,0.0,0.0,0.0
FMC Corporation,FMCCorp,2018-07-06,crop protection tools help growers reduce food loss starting on the farm find out more at 1 6,0.0,1.0,6.0
FMC Corporation,FMCCorp,2018-12-19,croplife asia dec 17 2018 the crop protection industry help minimize in crops by training on responsible use and application of pesticides find out more in this infographic and here 2 6,0.0,2.0,6.0
FMC Corporation,FMCCorp,2019-01-27,croplife asia jan 25 2019 up to 40 of the worlds crops are lost to insects diseases and weeds without these losses would double see how can help tackle here 1 5,0.0,1.0,5.0
NAVY CAPITAL,navycapital,2018-08-18,crystal crop may brands of fmc corp sun petrochemicals eyes assam co assets,0.0,0.0,0.0
NAVY CAPITAL,navycapital,2018-08-20,crystal crop protection buys four brands from us firm fmccorp,0.0,0.0,0.0
Bhagirath Choudhary,BiotechCentre,2019-01-04,deadliest pest of maize reaches needs to wake up to ground reality this invasive pest is a polyphagous nocturnal cropmunching pest will destroy food security manik ghose jan 4 2019 replying to havoc infestation in nadia murshidabad malda districts of wb,0.0,0.0,0.0
Ashish Verma,AshVerma111,2021-03-02,deal with fmc corp a leading global agricultural sciences company the agreement provides upl access in key markets prior to patent expiration to commercialize rynaxypyr active fmcs leading insecticide 2 18,0.0,2.0,18.0
,maksa92s,2020-03-21,dear fmc corajen is effective but its killing the fruit flowers,0.0,0.0,0.0
nikesh mundada,NikeshMundada,2019-07-31,dear sir your company employee not working in india maharashtra with parbhani dist 1,1.0,0.0,0.0
FMC Corporation,FMCCorp,2019-04-25,diplay holland tractor this is your chance to interact with a reallife tractor as used in farmers fields all over the country 1,0.0,0.0,1.0
FMC Corporation,FMCCorp,2019-04-16,diplay science is protection interactive blending demonstration and live bugs 1,0.0,0.0,1.0
FMC Corporation,FMCCorp,2019-07-07,dispels three common myths about pesticides in your food,0.0,0.0,0.0
Efarm News Ar,EfarmN,2019-07-07,do you want to understand how is the story of of fmc in the south cone we made an interview with a key manager in click here to know more 1 1,0.0,1.0,1.0
Efarm News Ar,EfarmN,2019-01-07,do you want to understand how is the story of of fmc in the south cone we made an interview with a key manager in click here to know more 5 5,0.0,5.0,5.0
Lobby For Climate,LobbyForClimate,2021-01-20,donated 1200 to s litigation center in 2018 some of the centers latest fmc corp v shoshonebannock tribes state of rhode island v shell oil products co llc portland pipe line corp v city of south portland 1 5 9,1.0,5.0,9.0
Accountable.US,accountable_us,2021-08-05,donated 12500 to rslc in march 8 1 4 12,1.0,4.0,12.0
The NAM,ShopFloorNAM,2020-03-30,donated 16500 masks to five health care systems in the philadelphia area 2 2,2.0,0.0,2.0
Golfdom,Golfdom,2021-06-13,donated 2500 to 30 local chapters of the allowing groups to support training and education photo istock comokimo golfdomcom fmc grants allow gcsaa chapters to boost education golfdom agricultural sciences company fmc corp donated 2500 to 30 local chapters of the gcsa of america allowing groups to support training and education 1,0.0,0.0,1.0
Adam Mossoff,AdamMossoff,2019-04-17,dude i grew up using a mower like this as one of my work jobs in my family and it was not easy to push this thing around heavy loud from that twostroke engine vibrated like crazy now todays selfpropelled models with the more modern engines are a different story 1,0.0,0.0,1.0
Lawrence Haun,LawrenceHaun,2018-09-15,ed we knew each other in the 80s and you were kind enough to treat laura kotsiris cal manufacturers assn and me fmc corp to breakfast in the white house mess for which ill always be grateful but i fear youve lost your way trumps not worth it,0.0,0.0,0.0
FMC APAC,fmcapac,2021-10-19,employee resource group igen intergeneration aims to develop and connect employees from all generations fmc asean india hr head and igen apac lead sanjay gopinath shares more about the workstreams vision 3 9,0.0,3.0,9.0
FMC APAC,fmcapac,2021-10-20,employee resource group people with disabilities aims to foster an inclusive environment for its disabled employees and their families this one of its workstream leaders raheel nasir fmc apac commercial excellence manager tells us more 002 115 views 4 12,0.0,4.0,12.0
FMC APAC,fmcapac,2021-10-12,employee resource group win womens initiative network aims to promote a genderbalanced workforce across the region this one of its workstream leaders saurin shah fmc asean zone manager shares his vision 1 3 11,1.0,3.0,11.0
Prabu Radhakrishnan,iymprabu,2021-03-01,enters in a longterm pact with fmc corp for rynaxypyr active fmcs leading insecticide as per pack co will toll manufacture supply rynaxypyr to fmc in india and fmc will supply the active ingredient to upl depending on markets what happened to the wife 1,0.0,0.0,1.0
Texas Eco News,TexasEcoNews,2020-09-22,epa completes cleanup of fmc corp landfill superfund list,0.0,0.0,0.0
Texas Eco News,TexasEcoNews,2017-12-21,epa settlement with fmc corp enforces federal pesticide safety protections,0.0,0.0,0.0
American Chemical Society,AmerChemSociety,2020-04-08,execs share how to make the workplace more welcoming rewarding for women 4,0.0,0.0,4.0
American Chemical Society,AmerChemSociety,2020-03-31,execs share how to make the workplace more welcoming rewarding for women 7 12,0.0,7.0,12.0
FMC Corporation,FMCCorp,2018-02-13,exhibit halls are looking good hope to see everyone there tomorrow fmc ag solutions will have booths in the south wing 6034 and 6032 1 1,0.0,1.0,1.0
Landscape Management,LandscapeMgmt,2021-06-04,expanded its fmc true champions loyalty program with the launch of the dynamic rewards rebate program that will provide lcos more attainable rebates find out more graphic lm staff landscapemanagementnet fmc expands access to true champions program offers easier rebates landscape management fmc expands its fmc true champions loyalty program with the launch of the dynamic rewards rebate program that will provide lcos more attainable rebates,0.0,0.0,0.0
Growth Market Reports (GMR),GrowthReports,2020-11-03,expected to reach usd 3771 million by 2027 with a cagr of 83 top key players read more prnewswirecom konjac market expected to reach usd 3771 million by 2027 with a cagr of 83 growth market prnewswire according to a recent market study published by growth market reports gmr titled konjac market global industry analysis,0.0,0.0,0.0
Raju Kapoor,rajukap,2019-10-09,fallarmyworm reported for the first time on in has been running to create awareness on this deadly among states and farmers in collaboration with agrowoncom 1 3,0.0,1.0,3.0
IngeniousStockTraders,IngeniousStock,2022-02-10,fallo for more lynx in bayu fmc fmc corprose above a 11461 buy point up nearly 6 after the company reported a 52 jump in quarterly profit sales rose 23 to 141 billion fmc manufacturers crop pr stocktwitscom fallo for more lynx in bayu fmc fmc corprose above a 11461 buy point up nearly 6 fallo for more lynx in bayu fmc fmc corprose above a 11461 buy point up nearly 6 after the company reported a 52 jump in quarterly profit sales rose 23 to 141 billion fmc,0.0,0.0,0.0
John Touey,JohnTouey,2018-08-28,files split plan new firm plans via inquirercom phillybased fmc files split plan new livent lithium firm readies ipo pierre brondeau says i was lucky,0.0,0.0,0.0
CHS Agronomy,CHSAgronomy,2018-11-14,flexes its market muscle post dupont asset acquisition by fmc closed on a large number of dupont assets thereby rocketing itself to become the fifthlargest global chemical company via 3 5,0.0,3.0,5.0
New Ag International,NewAgIntl,2019-06-05,floorplan available dont miss the last stands available register today and save 200 5 4,0.0,5.0,4.0
FMC Corporation,FMCCorp,2019-05-15,fmc ag us may 15 2019 listen in as experts share insights on how tree nut growers can strategically manage weeds that got a head start during the wet winter season visit or your favorite podcast platform to listen to this latest episode 030 558 views 3,0.0,0.0,3.0
