User,Handle,PostDate,TweetText,ReplyCount,RetweetCount,LikeCount
Thomas Chua,SteadyCompound,2022-08-31,replying to im not so sure about this didnt disclose how they calculated the figures data source bpcom bp energy charting tool energy economics home explore data from the statistical review of world energy online or download the app to your tablet or smartphone,0.0,0.0,0.0
Cameron Ford,civilresistorCF,2022-08-13,replying to im sick of seeing your ads you are a liar and and youre now trying to look green pack up your profits and piss off,0.0,0.0,0.0
@smithy,smithy,2022-08-15,replying to im sure your ceo is discussing changeson how to increase his 45mill salary while the rest of the country stress about paying their energy bills i bet hes sleeping well on his s 2,0.0,0.0,2.0
Jonno14,Jonno14273,2022-08-14,replying to im sure your ceo is planning his next multi million pound purchase after squeezing out every penny he can out of us hard working peoplewake up and smell the coffee bernard,0.0,0.0,0.0
Alan,SL03431948,2022-08-14,replying to imagine being the social media person for q company like this happy to get paid to lie mislead and shill for a company that creates poverty and destroys the planet,0.0,0.0,0.0
Tommy2holes,tommy2holes,2022-08-16,replying to imagine making record profits and ripping people off and making out you arent a complete wolf in sheeps clothing,0.0,0.0,0.0
Wijnand Hijkoop,WijnandHijkoop,2022-09-04,replying to in 2021 sunwind produced 27 of our energy need the investment energy not included the energy transition is a destructive solution to a nonexistent problem,0.0,0.0,0.0
1 more k,wasp707,2022-09-03,replying to in france from sept 1 to nov 1 will lower its petroleum fuel prices sold in service stations by 020litre compared to global market quotation prices followed by a 010litre reduction from nov 1 to 31 dec over to you totalenergiescom totalenergies commits to a largescale fuel price reduction programme until yearend for all of its paris 22 july 2022 to meet the expectations of french people affected by the increase in energy prices and the impact on their purchasing power the company is initiating a largescale fuel price,0.0,0.0,0.0
Tee,mr_notorious_t,2022-08-16,replying to incorrect the real statement should read your intention is to to rip off more people to make public more poor and starve them whilst bp makes billions of pounds in profit,0.0,0.0,0.0
stewart robinson,stewart_1979,2022-08-15,replying to increasing profits is all the ceo is interested in,0.0,0.0,0.0
Harrison Mace,harrison_mace5,2022-09-07,replying to instagramcom greenpeace international instagram video 1,0.0,0.0,1.0
Swale Mobile Sports Massage,alec46819,2022-08-14,replying to interesting use of the word affordable,0.0,0.0,0.0
Gary,GS070483,2022-08-14,replying to invest in people not dying because of the prices youre going to charge this winter how about you start there eh 1,0.0,0.0,1.0
Joe Kelly,nolbert622,2022-08-14,replying to is that like affordable housing where you literally have to find 70k deposit lets be fair youll never drop your prices even if you found the holy grail of free energy,0.0,0.0,0.0
Hugo Thompson,HugoThompsonEco,2022-08-15,replying to is the fossil fuel industry using the ukraine invasion as a cover for price hikes and record profits that will help their corporate takeover of our natural resources to transition to renewables windfarms should only get planning if they are 25 community owned like in denmark,0.0,0.0,0.0
deborah knight,briggs1957,2022-08-12,replying to is this a fuking joke,0.0,0.0,0.0
Gavin Drinkerati,Gavski5,2022-08-12,replying to is this a joke in this day and age u r sick,0.0,0.0,0.0
Neil Johnson,MrNigsey,2022-08-14,replying to is this a parody account,0.0,0.0,0.0
Jane Gilbert,msjanebond007,2022-08-15,replying to is this bp plc lots of entries for cancelling shares 10th august 22 and buying own shares 12th august 22,0.0,0.0,0.0
Gimme Dat Ting,GimmeDatTing,2022-08-12,replying to is this why your prices are so high right now,0.0,0.0,0.0
"Trebor, POME 231122",bigscrab,2022-08-13,replying to isnt companies like bp buying up cheap carbon credits from countries like indonesia mexico and brazil it could also be said that bp ripped off the inhabitants of these countries for personal gain 1 1 7,1.0,1.0,7.0
mr. drs. Peter Baars,PeterBaars1111,2022-08-24,replying to it is a disaster 1,0.0,0.0,1.0
Rob,robbo1056,2022-08-14,replying to it says affordable,0.0,0.0,0.0
Andre Paashaas,onderzoe,2022-08-22,replying to its all for the google and microsoft datacenters 9,0.0,0.0,9.0
Two dollars and a Casio,2dollarcasio,2022-08-24,replying to its funny how russias manipulation has benefited two uk incorporated companies shell plc and bp plc in particular 1 11,0.0,1.0,11.0
HD01,london_FB,2022-08-14,replying to its like tobacco companies saying smoking doesnt kill you nicotine does,0.0,0.0,0.0
China,ssdfresx,2022-08-22,replying to its not green it only makes youfriends richer 1 17,0.0,1.0,17.0
Anna-Wietske Jager,wietske_anna,2022-09-09,replying to its not green its toxic it kills birds and fish and you can not recicle it go away,0.0,0.0,0.0
S,vesemir_s,2022-08-14,replying to joke company joke campaign to fool masses the scam is up nationalise energy sector now,0.0,0.0,0.0
the quick brown fox jumps over the lazy dog,foxjumpsdog,2022-08-23,replying to just as we are dependent on russia for gas we rely on china for raw materials for windmills and solar panels additional we need an energy source when there is no sun nor wind wake up 1,1.0,0.0,0.0
Sophy Lennox,sophiahardie,2022-08-14,replying to just dont your greed profit and bonuses take priority over whether a person lives or dies right now you are showing you dont care you must be tories,0.0,0.0,0.0
DDB,DutchDrB,2022-08-23,replying to just give me petrol gif alt,0.0,0.0,0.0
Graham Twigg,graham_twigg,2022-08-12,replying to just out of curiosity why isnt hydrogen considered more its criminal what you shareholders and politicians are doing yes you have to make profit to invest fin the future but if you dont look after today theres no point looking at the future 1,1.0,0.0,0.0
Gail,BartramGail,2022-08-14,replying to just watched a documentary oil versus climate change i wont say anymore ill probably get banned,0.0,0.0,0.0
GusKGS79,GusKgs79,2022-08-13,replying to keep up the great work its certainly showing the benefits at the moment as we can all see energy has never been more affordable and it looks as if it will only get better enjoy your bonus,0.0,0.0,0.0
Hendrik,SchaeferHendrik,2022-08-15,replying to last thing i am going to waste my time with is listening to your greenwashing diatribe,0.0,0.0,0.0
jerome espana,jeromeespana2,2022-08-31,replying to liar,0.0,0.0,0.0
Heesackers,HHeesakkers1,2022-08-24,replying to liars,0.0,0.0,0.0
edward,edwardtwiti,2022-08-14,replying to liars robbers bp shell all of yous robbers,0.0,0.0,0.0
ALargeJD&Full-FatCokePlease,offsidepuppy,2022-08-14,replying to lies lies more lieswe wont fall for this shit any longer its not profit investment if youre paid to pollute subsidised by tax payers under the guise of renewablesits just more green washing gif alt,0.0,0.0,0.0
Muhammed Reza Tajri,mtajri,2022-08-13,replying to like increasing our profiteering and exploitation of ordinary people while the ceo takes home bns,0.0,0.0,0.0
James Rowlandson,jimrow79,2022-08-13,replying to literally taking the piss,0.0,0.0,0.0
Cuthbert Winklebottom,CryptoCuthbert,2022-08-14,replying to lol at some of these comments the people who were against fracking and plans for more nuclear power stations are now complaining about high energy bills 1,1.0,0.0,0.0
Mike Cooper,no_thyself,2022-08-12,replying to low carbon bollocks ban fossil fuels,0.0,0.0,0.0
Gavin Drinkerati,Gavski5,2022-08-12,replying to lower carbon going from tar sand to oil,0.0,0.0,0.0
David Jacobs,Jacobite51,2022-08-14,replying to lying bar stewards,0.0,0.0,0.0
10:30,ItimUTLR,2022-09-08,replying to making sure the 100k she got from is paid back in spades gif,0.0,0.0,0.0
Chris Windley Cyber Evangelist,cwindley,2022-08-13,replying to many congrats from continuous 247 365 monitoring and vulnerability scanning to the cyber essentials standard protecting ships superyachts ports rigs marine supplies,0.0,0.0,0.0
Inge,IngeJip,2022-08-23,replying to marinemadnessdotblogwordpresscom the effects of offshore wind farms on marine life written by owen harris increasing awareness about anthropogenic climate change and mounting public pressure has led to many countries committing to reduce their use of fossil fuels and increase the,0.0,0.0,0.0
Mr Pink,Mr_Pink13,2022-08-12,replying to maybe the climate hysteria that youve bought into is the reason for astronomical energy prices maybe you should be investing more in oil and gas to increase supplies,0.0,0.0,0.0
Helen Perry,helenroseperry,2022-08-14,replying to more greenwash,0.0,0.0,0.0
RhinoRob,RhinoRob71,2022-08-14,replying to more lies and greenwash,0.0,0.0,0.0
James Baxter,baxterontheloch,2022-08-14,replying to more smoke screens,0.0,0.0,0.0
Capria,Capriatonton,2022-08-15,replying to most of us will be dead by then and the blood will be on your hand,0.0,0.0,0.0
Matthew Todd,MrMatthewTodd,2022-08-13,replying to murderers forbescom oil and gas giants spend millions lobbying to block climate change policies infographic a recent report from influencemap claims that the worlds biggest oil and gas companies spend 200 million every year to weaken and oppose legislation aimed at fighting global warming 1,0.0,0.0,1.0
Gull,RomaCoolDancer,2022-09-04,replying to my guess is that each offshore windmill costs a lot more than it can ever deliver but im not a professor or een wetenschapper based on common sense and you dont know what side effects errosion etc will cause adverse damage to the environment 1,0.0,0.0,1.0
Jan Heeren,JanHeeren,2022-09-04,replying to never trust multinationals when they talk green,0.0,0.0,0.0
𝕾𝖎𝖗 𝕿𝖜𝖊𝖊𝖙 𝖆𝕷𝖔𝖙,JohannesLLC,2022-08-25,replying to no consent,0.0,0.0,0.0
Richard Thomas,R_I_C_H_T_1963,2022-08-13,replying to no one believes you anymore we need actions not words renewables should be your 100 priority and if they were all the worlds energy problems and co2 problems couldve been solved by now the evidence and scientific predictions have been available for decades act now,0.0,0.0,0.0
Buster Evers,manlikeb11,2022-08-14,replying to no one cares just lower your prices,0.0,0.0,0.0
Adele Kitching,AdeleKitching,2022-08-14,replying to no youre just a bunch of greedy nerdowells looking out for your fat cat mates,0.0,0.0,0.0
thejamjam.co.uk,parish1953,2022-08-12,replying to nob,0.0,0.0,0.0
pe,Peter28976934,2022-08-23,replying to nog meer chemisch afval,0.0,0.0,0.0
Tessa Harris,harris_tessa,2022-08-13,replying to not a great time to be putting out this sort of pr youre public enemy no 1 in case you didnt know,0.0,0.0,0.0
Hywel Lloyd,Hywel_Catalyst,2022-08-12,replying to not low carbon,0.0,0.0,0.0
Andrew Baker,AndrewB16481269,2022-08-15,replying to not sure bp and affordable belong in the same sentence higher dividends and share price that sounds more like it,0.0,0.0,0.0
Neil Prince,PrincNeil,2022-08-15,replying to not sure why you greedy b have turned up on my timeline should be ashamed of yourselves ripping us all off,0.0,0.0,0.0
freddy billington,billingtoni,2022-08-15,replying to nothing about affordable prices for the consumers 1,0.0,0.0,1.0
ShareDaFire,ShareDaFire1,2022-08-14,replying to notice you added the word affordable now muppets,0.0,0.0,0.0
rvs65,RvS1965V,2022-08-24,replying to nucleair,0.0,0.0,0.0
Good boy,LittleGreenBag,2022-08-22,replying to nuclear energy is better cheap reliable clean 1 4,1.0,0.0,4.0
Zer07,ZER07_JK,2022-09-01,replying to nuff said,0.0,0.0,0.0
Zer07,ZER07_JK,2022-09-01,replying to nuff said the pictures,0.0,0.0,0.0
glynn hughes,hughie4591,2022-08-13,replying to obscene disgusting false if this cretin really meant what he said he would take a pay cut and accept a windfall tax,0.0,0.0,0.0
billyzs1,billySTI1,2022-08-15,replying to of course with the money you earned since pandemic everything is possible this podcast should be for your employees,0.0,0.0,0.0
claudia daventry,cdaventry,2022-08-13,replying to oh do shut up nobody believes you,0.0,0.0,0.0
V A HUYING,VHuying,2022-09-04,replying to oh really doing some greenwashing bp when are you finally going to take responsibility for decades of inactivity concerning the shift to renewables plus stop your part of nowadays epidemic of prize gauging energy companies bullshit petroleum thats what you should be called,0.0,0.0,0.0
Jeremy Chatterton,therealchats,2022-08-14,replying to oops,0.0,0.0,0.0
Matthew Gibb,Mattygibb,2022-08-13,replying to optics,0.0,0.0,0.0
Doug,ColonelKaduggan,2022-08-13,replying to our ceo discusses the changes were making like price gouging consumers during a pandemic and profiteering from innocent peoples deaths in ukraine by adding 30 to the consumer price when oil only increased 10 per barrel in this podcast 3 10,0.0,3.0,10.0
Paul Nabbs,CefnPeeWee,2022-08-13,replying to parasites,0.0,0.0,0.0
FencePost,FencePo23739961,2022-08-13,replying to pathetic company,0.0,0.0,0.0
Simon Winterburn,WinterburnSimon,2022-08-14,replying to pay stay and stop all fossil extraction now,0.0,0.0,0.0
Rich,Trixsterwtf,2022-08-15,replying to pay tax you bunch of pricks 1,0.0,0.0,1.0
Jan met de Pet,010wijk11,2022-09-04,replying to pay taxes,0.0,0.0,0.0
Davy Jones Locker #YesScots,EdWard40100035,2022-08-12,replying to pay taxes to stop the col crisis otherwise theyll be nobody to pay for your energy in the future,0.0,0.0,0.0
smackgames,SmackGamesIO,2022-08-14,replying to people complain about profits probably my have a large part of their pension invested in bp,0.0,0.0,0.0
john riley,johnandrewriley,2022-08-16,replying to perhaps and are listening they are in a better position to help at least are doing something when boris is basting in olive oil on the beach,0.0,0.0,0.0
Sharon Hattersley,slhattersley,2022-08-16,replying to please can you ceo discuss how you are making record profits whilst increasing the bills of homeowners schools and hospitals to levels way beyond what people can afford,0.0,0.0,0.0
Man van letters,manvanletters,2022-08-31,replying to please shut up greenwashers,0.0,0.0,0.0
Aphaea,AphaeaCraft,2022-08-15,replying to please stop patting yourself on the back when driving a country of hard working people into crippling debt for your bosses to have bonuses youre doing a happy dance when people will die and their deaths will be on you and your ilk shame on you all disgusting,0.0,0.0,0.0
Two dollars and a Casio,2dollarcasio,2022-08-26,replying to please take a look at the accounts for bp plc and shell plc they are nothing to do with thunberg or the greens or just stop oil yet they are the ones gaining from all this 5 1 3,5.0,1.0,3.0
De dochter van Loek Hermans,KamerVragennn,2022-09-07,replying to pleasee,0.0,0.0,0.0
Jerzy Franczak,FrancJerzy,2022-09-06,replying to po dae to putinowi,0.0,0.0,0.0
White Mouse,DawnsioArYDibyn,2022-08-12,replying to posting positive little tweets wont help your case right now energy firms are the 21st century equivalent of marie antoinette and we all know what happened to her youd be much better off keeping a low profile or god forbid reducing your profits,0.0,0.0,0.0
René Dercksn,ReneDercksen,2022-08-22,replying to powering with gas and nuclear 1 5,1.0,0.0,5.0
Paul Johnson,PaulJoh32205398,2022-08-15,replying to profit profit profit get it out while you can,0.0,0.0,0.0
Matt,Matt_2510,2022-08-14,replying to profiteering fat cats happy to kill people and communities fuck and i cannot say this loudly enough bp,0.0,0.0,0.0
Gareth Morgans,garethmorgans,2022-08-13,replying to profits before people and planet 1,0.0,0.0,1.0
A Yellowbelly,AYellowbelly2,2022-08-13,replying to propaganda of the most blatant kind you control the supply chain and determine what the pricing is all along the line you could act on prices if you want to obviously you dont want to youre screwing the end users,0.0,0.0,0.0
Hannah Louise Roy,StageM_Hannah,2022-08-13,replying to questioning the use of affordable here,0.0,0.0,0.0
gothel,HelenGothel,2022-08-14,replying to read the room bp too much profit too little heart no point in profit if there is nothing left to spend it on,0.0,0.0,0.0
CanineMagic,K9Magik,2022-08-13,replying to really this is the promoted tweet you put out to someone in the uk in the middle of a heatwave greenwashing,0.0,0.0,0.0
James,James49808712,2022-08-15,replying to reject the great reset,0.0,0.0,0.0
Gull,RomaCoolDancer,2022-09-04,replying to retake fossil because it is not an inexhaustible provide by earth the offered alternatives are just commerce,0.0,0.0,0.0
F,FostasFury,2022-09-03,replying to right now dutch sea mills are falling apart better clean up that mess before building new ones,0.0,0.0,0.0
Stephen Lloyd,stephen_lloyd,2022-08-14,replying to ripping customers off is all you are good at,0.0,0.0,0.0
Deano !!!,Deano0901,2022-08-15,replying to robbing fukcers,0.0,0.0,0.0
Andrew John Macdonald,MADMAC969,2022-08-12,replying to rubbish you got caught out most of the money 60 of it goes to share holders not the green low carbon rubbish that you are pushing here,0.0,0.0,0.0
ianboyd,ianbugboyd,2022-08-14,replying to scratch bps skin and the angloiranian oil company shines through same statesponsored privateering but now dressed in green for its climate manoeuvres,0.0,0.0,0.0
CB,Chrisbrennan88,2022-08-13,replying to scum,0.0,0.0,0.0
Seth,NawkSeth,2022-08-22,replying to scum 1,0.0,1.0,0.0
Conroe Walters,ConroeWalters,2022-09-04,replying to sen burke sep 2 2022 when oil companies say theyre going green sign the petition to help ban misleading fossil fuel ads show this thread,0.0,0.0,0.0
Singh Is king,SinghIs97729933,2022-09-01,replying to send inbox,0.0,0.0,0.0
Bubs,slf_toon,2022-08-13,replying to shove it up the crack of your arse,0.0,0.0,0.0
T46,tfortysix,2022-08-14,replying to shut up youre lying,0.0,0.0,0.0
Rolf in Kenia,Dewik2013,2022-08-22,replying to since dutch homes are powered by wind the costs of energy went up 300 thank you dude 2 1 24,2.0,1.0,24.0
Plastics Rebellion,PlasticsRebel,2022-08-13,replying to smell bullsht here 1,0.0,0.0,1.0
Mickel,Melkyway85,2022-08-15,replying to so does the bp ceo see these comments anything to say on them perhaps or is it an echochamber that he operates inside,0.0,0.0,0.0
Richard,mcjewkes,2022-08-14,replying to so of the profits made to date this year bns how much of that will you actually invest it on non oilgas project this year a percentage will do,0.0,0.0,0.0
BlueLister,RaymonBluington,2022-08-12,replying to so the customer is paying record amounts for the energy that you are making unaffordable for them now reaping record profits so that you can sell us low cost energy which will be affordable in future your taking the piss you invest because you profit from it from us 1,0.0,0.0,1.0
Linda Simmons,siml01,2022-08-14,replying to so whats with the sonic booms in the oceans looking for oil and gas deposits all about or do bp just really hate whales,0.0,0.0,0.0
John Stretch,johnstretch,2022-08-14,replying to so your core business will be oil gas and subsidies,0.0,0.0,0.0
Occasional Pictures of Ducks,OccasionalDucks,2022-08-14,replying to so youre stopping all fossil fuel extraction by cop tomorrow thought not,0.0,0.0,0.0
PaulMak,pmak27,2022-08-14,replying to someone charged bp loads of cash to tell them to be proactive right now theyre that shit they did it how can they not see the best advice is to keep the lowest profile you can right now not understanding this will fuck people off is beyond belief 1,0.0,0.0,1.0
Mark Hendy,markhendy,2022-08-15,replying to sorry old chap but its oil and gas that we need we need cheap energy not blood from a stone prohibitively expensive energy from the green loonies windysunny utopia,0.0,0.0,0.0
christina bohonis,christinabohons,2022-08-14,replying to spare me from this propaganda,0.0,0.0,0.0
Hud Pug,HudPug,2022-08-14,replying to start investing 6 billion each quarter now and you may just about nibble at the guilt on the conscious of all you employ your share holders and above all your executive and ceo stop talking start doing 1,0.0,0.0,1.0
Diamant Parler: @DejMeijer,Diamant Parler: DejMeijer,2022-09-05,replying to starting gas extractions in groningen again and nuclear energy 2,2.0,0.0,0.0
WouterA,Doctordapp,2022-09-05,replying to stop following this green dream its already becoming a nightmare for normal people,0.0,0.0,0.0
phil potter,philpotter66,2022-08-15,replying to stop gaslighting people you thieving bastards,0.0,0.0,0.0
Dave Houston,DaveHDev,2022-08-12,replying to stop it just return fuel prices back to normal please thank you,0.0,0.0,0.0
Bob,KlausSquib,2022-08-13,replying to stop lying,0.0,0.0,0.0
“I cant breathe”_Quincy,10lugubrious,2022-08-14,replying to stop lying gif alt,0.0,0.0,0.0
Bovenstoom,Bovenstoom,2022-09-02,replying to stop lying please nothing green about green h2 because the process is extremely wasteful the lost energy must be replaced with dirty electricity net sum extra co2 not less want calculations 1,0.0,0.0,1.0
Ach Well Foley,AchWellFoley,2022-08-14,replying to stop producing oil and gas now you are killing our planet,0.0,0.0,0.0
Andy West,andydw,2022-08-14,replying to stop profiteering from an energy crisis you terrible people,0.0,0.0,0.0
Andy West,andydw,2022-08-14,replying to stop profiteering you evil gits,0.0,0.0,0.0
WhatALoadOfRubbish,ALoadOfRubb1sh,2022-08-14,replying to stop stealing from people youre so unbelievably evil its untrue you have the power to create completely eco friendly energy but you dont want to do that do you 1,0.0,0.0,1.0
DC Coordinator of the Entire Shit Show,DC30871833,2022-08-24,replying to sure bpit must feel poweful being part of the wef criminals you cannot forse a nation who will be not happy and own absolute nothing so bp got luck and bye bye you will not be happy as i will not use you anymore weforumorg partners our partners,0.0,0.0,0.0
DC Coordinator of the Entire Shit Show,DC30871833,2022-08-24,replying to sustainable globalists liars,0.0,0.0,0.0
Marita,MaritaLalaguna,2022-08-13,replying to tell your pr department to pack up their things its all over,0.0,0.0,0.0
Thomas Chua,SteadyCompound,2022-08-31,replying to thanks cj yeah this data leaves me with so many questions 1,0.0,0.0,1.0
CraigJ VersionSeries,Sharplin46,2022-08-12,replying to that went well doubtful any energy firm promo is going to get a good reception price hikes and record profits and sending many into poverty tends to do that 1 1,0.0,1.0,1.0
Oliver.Gill,Olivergill4B,2022-08-25,replying to thats almost the template for neatly summed up in this grauni article just prior to russia main invasion of ukraine theguardiancom bp has ambitious plans to move beyond fossil fuels but are they enough the oil giant revealed its fourfold increase in profits alongside pledges on investment in cleaner energy 1,0.0,0.0,1.0
Skenoo Ventures Inc,skenooHQ,2022-09-10,replying to thats putting it mildly besides may have something to say about that since invested in their technology im optimistic they will help reshape the energy landscape in europe beginning with germany 1,0.0,0.0,1.0
sirdaveking,KingSirdave,2022-08-16,replying to thats you that is,0.0,0.0,0.0
TheHiddenDumbass,DumbassHidden,2022-08-12,replying to the ceo is actually named looney its all making sense now,0.0,0.0,0.0
Melissa,BlissNjoy,2022-08-23,replying to the following media includes potentially sensitive content change settings view 1,0.0,0.0,1.0
Two Stroke 63,63_two,2022-08-12,replying to the great green con,0.0,0.0,0.0
Shrewsbury Greens,ShrewsburyGreen,2022-08-16,replying to the longer we take to move from fossil fuels to renewables the less affordable it becomes,0.0,0.0,0.0
jumbo whiffy.,Beefyinlaw,2022-08-13,replying to the west will collapse within 5 years if we dont overturn the climate change lunacy in the name of this evil energy supplies are being cut off and farmers ordered to reduce production when ur children starve in the street or freeze in winter dont say u werent warned,0.0,0.0,0.0
Michael Maddison,MickMaddison,2022-08-13,replying to then why are your petrol stations always the most expensive,0.0,0.0,0.0
Sassan,Sassan_sir,2022-08-13,replying to theyre trying to justify making extortionate profits from peoplebusinesses misery which will never ever be justifiedyou would have still invested before the record profitswhy dont you pass on the fall in oil wholesale prices in last few weekswhy are u crippling the country 1,0.0,0.0,1.0
Gra,HickmanGra,2022-08-13,replying to thieves,0.0,0.0,0.0
Steve,Superfx101,2022-08-13,replying to thieves evolve politics aug 10 2022 since 2016 both bp and shell have been huge net beneficiaries of the uk tax system having been handed a cumulative total of 727m of uk taxpayers money over this period this is despite the firms making 10s of billions in profit and paying bns in tax in other jurisdictions show this thread 1,0.0,0.0,1.0
NeilDK,lordsnuff2,2022-08-15,replying to thieves thats what you are nothing less than thieves,0.0,0.0,0.0
Danny Griffiths,griffo17,2022-08-13,replying to thieving robbing greedy bastards,0.0,0.0,0.0
Overmyheadphotography,Overmyheadphoto,2022-08-14,replying to think you need to remove affordable from this tweet,0.0,0.0,0.0
scott,ReservoirPup,2022-08-13,replying to this ceo you mean theguardiancom bp boss bernard looneys pay almost doubles to 45m in 2021 remuneration package includes 14200 wage increase and 24m in bonuses for financial performance 1 3,0.0,1.0,3.0
Sue Hagley,sue_hagley,2022-08-13,replying to this is all so much fuing greenwash,0.0,0.0,0.0
